titles,category
대통령 교육 박순애보건복지 김승희 지명여성 발탁종합,Politics
진중권 박지현 논란은 이재명 부진 때문 대신 희생양될 듯,Politics
단독 유승민 야수의 본능 출간내달 초 출판기념회,Politics
이수진  때리며 검찰공화국 폭주 막기위해  당선시켜야,Politics
박지현 민주당은 팬덤정치와 결별해야이게 가야할 길,Politics
최강욱 비상징계 이뤄지나박지현 선거 뒤로 못 넘긴다,Politics
단독 성 비위 논란 윤재순 딸도 대통령실 출근 의혹아빠 찬스 논란까지,Politics
옥중 김경수 양손 하트로 프사 바꿨다정치재개 움직임,Politics
 노도강금관구현역 민주당 텃밭도 위태롭다,Politics
박홍근 인사검증 손에 쥔 한동훈 세기 빅브라더 되겠다는 것,Politics
북 천리혜안 꿰뚫어 본 덕분에 코로나 방역 자화자찬종합,Politics
윤형선 큰 차이 아니겠지만 승리 확신이재명 절대  못 넘어,Politics
김건희 여사 봉하마을 찾아  영부인 권양숙 여사 만난다,Politics
 보수텃밭 강남오세훈 앞마당 광진 국힘 탈환 기세,Politics
 한강벨트 초강세 국민의힘년 전 곳 휩쓴 민주당 고전,Politics
 이재명 이겼던 개 구 중 국힘 개구 우세 개구 경합 우세,Politics
 대통령 떠난 종로 대통령 맞은 용산모두 빨간 물결 가득,Politics
이재명 어려운 선거로 예상쉬웠으면 출마하지 않았을 것,Politics
김남국 명예퇴직 때도 예우하는데 낙인찍어 나가라는 식 옳지 않아,Politics
정책이냐 인생 스토리냐 쪽 선거공보물이 말하는 내용은,Politics
이영 장관 본화의 통과 일 내 소실보전금 지급,Politics
 용퇴론 박지현 비난성희롱 등 문자 정말 많이 받았다,Politics
안철수 김병관 나보고 철새 결국 이재명 셀프디스,Politics
이재명  내부 문제 선거에 심각한 영향 없을 것,Politics
안철수 교육부복지부 장관 추천했다선택은 인사권자 몫,Politics
박용진 이해찬 송영길 이재명도 한 사과 왜 박지현만 안돼,Politics
김남국 박지현 갑자기  나가라 폭력적이고 위압적,Politics
김건희 여사 조만간 봉하 찾아 권양숙 여사 예방,Politics
이준석 당대표 재도전 묻자안철수 본인이 하겠다는데 뭐,Politics
김병관 철수 정치 끝장 안철수 반응 왜 이재명 비난 지방선거,Politics
대통령 윤종원 국조실장 임명 당정 갈등에 총리 손 들어줄 듯,Politics
일보다는 정치에 관심오세훈 송영길 직격,Politics
 용퇴 발언에 파열음국조실장 인선 놓고도 잡음,Politics
하태경 민주당  보다 못해 쇄신해야,Politics
박용진 박지현 사과하게 만든 당 현실 때문에 선거 힘든 것,Politics
안철수 뼈있는 말 철수정치 끝내라 이재명 셀프디스인데,Politics
검찰공화국 소통령의 전성시대 열리나,Politics
남성욱  미사일 도발 핵 선제타격 능력 보여주기 의도,Politics
대한항공  전투기 창정비 사업 완료년간 대 정비,Politics
이준석 윤형선 선거운동원 등록이재명 저지 집중유세 나선다,Politics
박지현 내부총질 비난 민주당 개혁에 저항하는 것,Politics
북한판 이스칸데르 섞어 쏜  관영매체 일체 보도 없어,Politics
김남국 박지현  나가라 식 폭력적명퇴도 이렇게 안 시켜,Politics
진중권 민주당 내홍 이재명 부진 탓 결국 박지현이 희생양 될 것,Politics
안철수 이준석 당대표 재도전 본인 자유,Politics
윤형선 목동 주소지 이전 우연의 일치일 뿐,Politics
 만취 보도에 황교익 끔찍국힘 포샵 너무 티 나,Politics
진중권 처럼회 민주당 지지율 깎아 먹는다김남국 답변은,Politics
지방선거 여야 격전지 부상 인천 계양을 화력 집중,Politics
윤형선 가 대선과 국회의원 선거 혼동한다는 게 민심 은 배은망덕한 먹튀,Politics
최강시사 남성욱  미사일 발 발사  향한 도발 시작됐다는 메시지,Politics
김주대 시인 폭탄발언 조국한동훈 나란히 앉아 그대가 조국 보길,Politics
옥중 김경수 손하트 프로필 교체 지지자 보고싶다,Politics
박지현  다 은퇴하란 적 없다 내부총질 비난 난 괜찮아,Politics
박지현 성희롱 발언 최강욱 필요하다면 비상징계조속히 처리,Politics
부상 귀국하는 이근아직 우크라에 있다,Politics
이재명 민주 내부 문제 심각 영향 안 미쳐투표하면 이겨,Politics
박남춘유정복이정미 인천시장 토론 결점 들추기 격화,Politics
영상국힘 년전 송영길의 노룩악수 꺼내든 이유,Politics
이재명 정당지지율 차이 크지만바닥정서는 다르다,Politics
조응천 박지현 형식절차 틀렸지만 결국 나도 편들었을 것,Politics
북 천리혜안 꿰뚫어 본 덕분에 코로나 방역 자화자찬,Politics
조국 거짓말쟁이 몰아서울대 사직 의사 밝혀 반박,Politics
김남국  용퇴론 불쑥 튀어나와갑자기 나가라는 건 폭력적,Politics
양손 모아 손하트 수감 중인 김경수 페북 사진 바꿨다,Politics
진중권 결국 만만한 게 박지현 이재명 대신 희생양 될 듯,Politics
박지현 지키자 확산조응천 답답한 민주당  대의에 맞아,Politics
이준석 당대표 재도전 질문에 앙숙 안철수의 짧은 한마디는,Politics
이재명 인천 계양을 예상 밖 접전에정당 지지율 격차 영향,Politics
 윤종원 국조실장 인선 한덕수에 일임관계자 총리 의지대로,Politics
 탄도미사일 섞어쏘기에 정세현 한미일 갈라치기,Politics
하태경 박지현은 리틀 송영길  조응천  안맞는 갑툭튀그래도 지지,Politics
한쪽 운동원 차엔 뭉칫돈 한쪽은 돈봉투 건넸다 극단적 시도인구 만 장수군에 무슨 일이 지방선거,Politics
인사정보관리단 논란조응천 결국 왕장관 위협적 일상관리 가능,Politics
김건희보다 싫다  파괴자 박지현 쇄신하려다 식물대표 위기,Politics
 코로나 풍토병 단계 진입대유행 종식될 것,Politics
 주재에 정부 성명까지도발에 안보 태세 갖춘 ,Politics
윤대통령 집무실 책상엔 바이든 선물 의자 뒤엔 반려견 사진 두장이,Politics
박지현 표현의 자유 아닌 명백한 폭력에 민주당은 침묵했다,Politics
박지현 용퇴 언급에 조응천 얼마나 답답했으면 대부분 공감,Politics
경기충남지사 대전세종시장 선거 끝날 때까지 결과 예측 어려울 듯,Politics
의 번째 침묵미사일 발사 보도 안하는 이유,Politics
 에세이 출간이재명은 합니다 제목 버렸다 새 제목은,Politics
조국 서울대에 사의표명 분명히 했다날 거짓말쟁이로 몰아,Politics
이재명   윤형선  한국리서치,Politics
서울대와 싸우는 조국 절 거짓말쟁이로 몰아사직 의사 분명히 밝혔다,Politics
김남국 박지현  너 나가라명퇴도 이렇게 안 시켜,Politics
박지현을지키자 트위터서 박지현 수호 맞불,Politics
하태경 한동훈 소통령 장관 영원히 하는 것도 아니고,Politics
유권자 만시대 하향곡선 그리는 투표율고작 대,Politics
김남국 박지현  너 나가라 식명퇴도 이렇겐 안 시켜,Politics
대장 명 전원 교체정부 홀대했던 육사 출신 중용,Politics
대통령실 윤종원 충돌권성동 불가  한 총리 훌륭,Politics
목 데일리안 출근길 뉴스 윤호중 이게 지도부냐 책상 치고 이석박지현 나를 왜 뽑았느냐 등,Politics
윤석열 정부 출범 보름 만에당정 윤종원 내정 불협화음,Politics
박지현  용퇴 논의해야민주당 선거 코앞 파열음,Politics
북한 차 핵실험 임박기폭장치 작동시험 탐지아침 월드,Politics
진중권 박지현 논란 이재명 부진 탓선거지면 희생양 될 듯,Politics
박지현 민주당 제 식구 감싸기 이준석 지지자보다 심해,Politics
아무리 급해도 품격이이재명 목에 손 그으며 이번에 지면 정치생명 끽,Politics
한미 지대지미사일 대응 사격 전투기 여 대 출격,Politics
윤 대통령 취임 후 첫  소집한미 미사일 발사 맞대응,Politics
북 바이든 귀국길에 미사일 발 발사올해 번째  발사,Politics
인천시장 후보들 토론서 매립지 이면합의 논란 난타전,Politics
박남춘유정복 상가투기흑색선전 의혹 놓고 거친 설전,Politics
속보 미 유엔 안보리 수일내 추가 대북제재안 표결,Politics
한미일 겨냥 미사일 섞어쏜 북전략폭격기 띄운 미,Politics
  쐈는데 관영매체는 이번에도 보도 안해,Politics
조국 기소 이유로 사직 받아주지 않아 서울대 사의 표명 전달된 바 없다,Politics
박지현 대국민 호소 둘러싼 민주당 내분 공개 폭발,Politics
박지현 민주당 제 식구 감싸기온정주의 이준석 지지자보다 더 강해,Politics
격전지를 가다 문 전 대통령 귀향 양산시민주국힘 후보 번째 대결,Politics
 지방선거 코앞인데들쭉날쭉 여론조사 결과 왜,Politics
김기현  선거 때문에 사과하는 척 계양에 세금 내본 적 있나,Politics
대통령실의 선택은 삼성 아닌  관저도 공개된 청와대,Politics
김남국 박지현  존중 없이 나가라 명퇴도 이렇게 안시켜한판승부,Politics
데일리안 여론조사 오세훈 지지율 과반송영길에 오차범위 밖 우세,Politics
박지현   정면충돌민주 지지율 하락일로 혼돈,Politics
단독 우크라이나 차 지원은 방독면 등 화생방 대응장비,Politics
진중권 지지율 깎아먹는 처럼회 해체해라김남국 답변은,Politics
고립되는 것은 박지현인가 민주당인가,Politics
 국민희망대표에 호 시계 선물오영수 집무실 참 소박,Politics
김규현 청문회 세월호 책임   의도성 없어,Politics
진중권 박지현 논란 이재명 부진 때문 희생양될것,Politics
대통령 만취짤에 황교익 끔찍 국힘 포토샵,Politics
 흔들리는 민주당여론전 고삐로 지선 승기 다잡는 국민의힘,Politics
바이든은 왜 일본에만 선물을 줬나 윤석열 정부의 오산 임상훈의 글로벌리포트,Politics
여론조사 이재명   윤형선  초접전분당갑 안철수 우세,Politics
 용퇴 발언에 파열음국조실장 인선 놓고도 잡음,Politics
그룹에 정치적 사망선고 내린 박지현 독자적 쇄신안 내놓을까,Politics
 용퇴론에 개인 의견일 뿐내홍 계속,Politics
바이든 떠나자 종 이상 첫 동시발사,Politics
 격전지 윤형선 계양 윤내과에서 진료한 주민만 만명 넘는다,Politics
핵기폭장치 작동 시험차 핵실험도 임박,Politics
권성동  잘못된 경제정책 수용하는 꼴 윤종원 거듭 비토,Politics
바이든 떠나자 미사일 쏘아올린  정부 국제적 고립 자초,Politics
옥중 김경수  프로필 손하트 사진 바뀐 이유는난리 난 네티즌들,Politics
전국서 쏟아지는 삼성 공장 유치 공약에 기업들 난감,Politics
박지현  용퇴론 꺼내자 내부총질 말라 고성 오간 민주,Politics
와이파일 신냉전과 미국의 민주평화론 역사는 반복될까,Politics
논란의 이 공약 시속  지하철도부산 민심 뜨겁다  현장 이곳,Politics
이번에는 이낙연 정치인 발길 끊이지않는 양산 사저,Politics
전원책 한동훈 인사검증 왜 소통령 소리 듣나 바보짓,Politics
김남국 박지현  너 나가라는 식명퇴도 이렇게는 안 내보내,Politics
중러 카디즈 무단진입에 미사일까지 한반도 신냉전 시작됐다,Politics
이재명의 쉬운 선택 험난한 앞날 예고하나,Politics
청년 부르짖더니올드보이 넘쳐나는 선거,Politics
핵실험 임박에 핵우산 논의 가속될듯한반도 기류 냉각,Politics
거짓말쟁이는 당신박남춘유정복 마지막 토론회서도 비방전,Politics
진중권 박지현 논란 이재명 부진탓선거 지면 대신 박지현 희생양,Politics
국정원장 청문회서 북 미사일 도발 배경 보고코로나도 이유,Politics
 핵능력 과시 극대화 섞어쏘기 이어 핵실험으로 간다,Politics
 집무실 찾은 깐부 오영수 참 소박하고 아름답다,Politics
조국 사직 안받아줘 월급 수령서울대 사의 없었다,Politics
비검찰 고위직 대거 물갈이 전망 정부 다시 법무부 검찰화되나,Politics
이재명 손으로 목 그으며 지면 끽 이준석 정치 희화화 제정신 아냐,Politics
공염불로 끝나는 선거용 레퍼토리 이번에도 찻잔 속 미풍 될 듯,Politics
한미 밀착 보란듯  요격 힘든 섞어 쏘기,Politics
년만에 육사 출신 합참의장 대장 명 전원 교체,Politics
김건희여사 나한테만 사진 보낸다 건희사랑 공식팬클럽 회장이 한말,Politics
당만 달라도 젊으니 다음에당적나이 이중벽 맞서는 청년,Politics
한동훈도 못 본다 인사검증 자료시스템 개선으로 봐달라,Politics
표정관리 들어간  집토끼 결집 사활 건 ,Politics
내 승리가 정부의 승리 이준석과 충남 훑은 김태흠의 각오 밀착마크,Politics
오만한 민주당과 난 다르다 독종 양승조의 혈투 밀착마크,Politics
에 성비위 변수 회오리 격차 양승조김태흠 진땀 승부 현장 이곳,Politics
재산 위  벤처신화 주역 대결경기성남 분당 갑,Politics
황교익  동급  비난에 대변인이 꺼낸 사진,Politics
북한  찍고 차 핵실험으로 직진 정부 핵 기폭장치 작동 시험 중,Politics
박지현 광기에 익숙해진 민주광야에 홀로 선 느낌,Politics
국힘 대 명 광주 구의원 출마 로 민주 골수팬 부모님 설득했죠,Politics
국무조정실장에 정부 경제수석 내정 권성동 우려 전달,Politics
 이번엔  등 섞어쏘기 핵 기폭장치 시험도,Politics
정부  수뇌부 물갈이 년 만에 육사 출신 합참의장 임명,Politics
검찰의 국정 장악  과도한 권한 분산 여야 다시 충돌,Politics
인터뷰 대장동 수사 정치보복 아냐 이재명 후보 책임회피 못해,Politics
핵실험 마지막 준비 단계 강행 땐 한반도 일촉즉발 위기,Politics
바이든 순방 땐 잠잠하더니 뒤통수에 미사일 쏜 격,Politics
바이든 떠나자마자 도발하는 북한대통령 대북 정책 시험대,Politics
민주당 검찰 모든 국가권력 독식 법무부 장관 중간보고 안받을 것,Politics
권성동 반대에도 대통령 국조실장에 윤종원 임명 기류,Politics
박지현  용퇴 윤호중 책상 치고 나갔다,Politics
대장 전원교체 년만에 육사 출신 합참의장,Politics
박지현 개딸들 사퇴 요구에도 국민들 민주당에 희망있는지 보고 있다,Politics
미국 본토 겨냥한  한국 노린   처음 섞어 쐈다,Politics
기업이 돈 벌면 날 돕는 것  비 맞으며 테이블 개 돌았다,Politics
북한 바이든 귀국 비행 때 무력시위정부 차 핵실험 임박,Politics
이재명 국힘 오물 덕지덕지 이준석 제정신 아니다,Politics
 선거 코앞 내홍 박지현  용퇴 윤호중 책상치고 나가,Politics
육군대장 명중 명 육사 내부 정부서 배제된 육사 부활,Politics
  소집 확장 억제 조치 주문 한미 맞대응 미사일 발사,Politics
바이든 착륙 시간전에   발 발 섞어 쐈다,Politics
 한미일 겨냥 발 발사 핵실험도 초읽기,Politics
민주 너희끼리 하세요 국힘 나도 못 하겠다차 추경 협의 결렬,Politics
 기업인 부인과 영상통화도이런 스킨십 없었다,Politics
박남춘유정복  토론서 빚 상환 실적 놓고 설전,Politics
작심 박지현 윤호중이 공동회견 제안 거절지엽적 문제로 트집종합,Politics
박지현 비대위원장의 절규암흑의 겨울 정부 시대에서 희망 찾을 수 있도록 민주당 바뀌어야,Politics
한동훈 인사검증단 때린 전원책 왜 왕장관 소리 듣나 바보짓,Politics
홍천횡성철원군수 접전강릉동해시장 국힘 우세,Politics
여론조사 동해 강 구도 홍천횡성 인 접전 철원 보수 표 분산,Politics
한미 맞불 작전 전략폭격기원자력 항공모함 뜨나,Politics
대장 명 교체 문 정부 때 군 수뇌부 통째로 바꿨다,Politics
박지현 민주당 제 식구 감싸기 이준석 지지층보다 더 강해,Politics
북 도발 직후 미 전략자산 폭격기 일본 상공 출격,Politics
김규현 윤 대통령 국정원은 절대로 국내정치 개입 말라 엄명,Politics
북한  카드 다음은 핵실험 또 나온 벼랑끝 전술,Politics
북  쏘고 핵실험 조짐윤 대통령 강력 경고,Politics
이재명  윤형선 김병관  안철수 ,Politics
여당 곳 이길 것 야당 곳 승리 예상,Politics
이재명 덮은 박지현 존재감민주당 세대교체론 내홍,Politics
  도발에 상응 대응 예고잘못된 남북 관계 정상화,Politics
민주 자중지란 악화박지현 사과에  중진개딸 모두 반발,Politics
윤호중 이게 지도부냐 책상 치고 이석박지현 나를 왜 뽑았느냐,Politics
박지현 광기 익숙해진 민주이준석 지지자와 다를바 없어,Politics
 첫 대장 인사 육사 부활군 수뇌부 명 전원 교체,Politics
나이트포커스 이재명 발등에 불지면 정치생명 끝끽 ,Politics
박지현 민주당 제식구 감싸기 윤석열이준석보다 더 강해,Politics
나이트포커스 지방선거 판세 몇 대 몇,Politics
권성동 과거정부 있었다고 윤종원 반대 아냐 고민한다 해,Politics
나이트포커스 박지현의 어퍼컷쇄신인가 분란인가,Politics
박지현 작심 비판 우리 당의 벽도 윤석열 이준석의 벽보다 낮지 않다,Politics
국무조정실장 내정했는데  정부 경제실패 책임자 안 된다,Politics
밥그릇 싸움에 고장 난 국회 국세청장 청문회 패싱하나,Politics
박지현 국민 목소리 무서운 줄 모르고지엽적인 문제로 트집종합보,Politics
바이든 선물토리 안은 사진 눈길 소박하고 아름다워,Politics
대통령 구두 만든 바이네르 김원길 대표 억 이상 홍보 효과,Politics
대통령 살던 은밀한 곳청와대 관저 열렸다 포착,Politics
이준석 대통령 대전충청에 진 큰 빚 갚을 기회 달라,Politics
이재용최태원정의선구광모신동빈 대통령과 나흘 만에 한 자리,Politics
기자출연광주전남 무소속 돌풍 속 민주당 역습,Politics
손으로 목 긋는 시늉 이재명에 이준석 제정신 아닌 듯,Politics
이재명 러브콜 받은 박지현은 왜 미운털이 박혔나 뉴스,Politics
윤석열 대통령 첫 기념시계 공개역대 대통령 시계 살펴보니,Politics
박지현  퇴장 놓고 민주 내분 격화종합,Politics
권성동 에 윤종원 반대 의견 전달불협화음 조짐,Politics
 퇴장 준비  개인 행보민주당 투톱 충돌,Politics
조국 사직 받아주지 않아 월급 일부 수령 서울대 사의 표명 없었다,Politics
청와대서 가장 은밀한 곳 관저 열렸다내부에 사우나벽난로,Politics
신동욱 앵커의 시선 우리는 과연 다를까,Politics
남은 건 핵실험핵 기폭 장치 작동시험 탐지,Politics
김규현 북한 스스로 비핵화할 의지 거의 없다고 본다,Politics
 단거리 섞어쏘기방어망 무력화 노린 듯,Politics
격전지광양시장 민주당무소속 양강구도,Politics
지선 인터뷰 권성동 국민의힘 원내대표에게 듣는다,Politics
서울 오세훈  송영길 경기 김은혜  김동연 ,Politics
문 정부 수석 윤종원을 왜여당 인선에 공개적 반대,Politics
민주당 전남 무소속 돌풍 반격 나서지도부까지 출동,Politics
송영길  오세훈 김동연  김은혜  조원씨앤아이,Politics
민주당 지도부  용퇴론 놓고 고성갈등 격화,Politics
대장급 군 수뇌부 전원 교체 문재인 정부 지우기,Politics
한미일 밀착에 북중러 일제히 반격한반도 신냉전 방불,Politics
격전지원주갑 오차범위 접전 정세균권성동 여야 지원사격종합,Politics
전임자 역점사업 놓고 엇갈린 후보들무예마스터십 운명은,Politics
너희끼리 하세요  나도 못하겠다여야 차 추경안 진통종합보,Politics
따져보니 법 개정 없이 인사검증 위법사실일까,Politics
 용퇴 발언에 파열음국조실장 인선 놓고도 잡음,Politics
여론조사 이재명   윤형선  초접전분당갑 안철수 우세,Politics
무소속 돌풍 불까한계도 있어,Politics
다급한 이재명 지면 정치인생 끝계양을 초접전 양상,Politics
박지현  용퇴 발언에 윤호중 책상 쾅내홍 커진 ,Politics
바이든 귀국 비행중  도발에스퍼 년 전쟁 준비,Politics
경기도 명심과 윤심 박빙 재격돌지방선거 격전지 르포,Politics
북 한미일 동시 겨냥 미사일 발 쐈다,Politics
연합사합참 출신 작전통 수뇌부에 전면 배치한미동맹 강화,Politics
대통령 대장 명 전원 교체정부 홀대 육사 출신 중용,Politics
양산시장 토론회정책공약보다 흡집 내기 주력,Politics
개월 된 해군총장까지윤석열 정부  수뇌부 전원 물갈이,Politics
이재명윤형선 오차 내 접전분당갑은  우세,Politics
합참의장에 김승겸 내정군 대장급 인사 명 전원 교체,Politics
권성동 에 윤종원 반대 의견 전달불협화음 조짐,Politics
남은 건 핵실험핵 기폭 장치 작동시험 탐지,Politics
백브리핑 지면 정치생명 끽 이재명 손동작 하나도,Politics
깐부 오영수  기념시계 받았다집무실 참 소박,Politics
첫 대북 메시지부터 강경 윤 대통령 한미 확장억제 실행 경고,Politics
차 추경안 진통너희끼리 하세요  나도 못하겠다,Politics
이재명  윤형선 김병관  안철수  한국리서치,Politics
북한 첫 미사일 섞어 쏘기 도발 한미일 한날한시에 공격하겠다,Politics
공개된 바이든의 선물 집무실 책상 위 트루먼 것과 같은 이 팻말,Politics
뉴있저 쿼드 정상 회의 주요 내용과 중국 반응은,Politics
문 정부 경제수석 기용 반대 갈등 조짐,Politics
영상 윤건영 한동훈이 대국민 사기를 한 것이냐,Politics
다시 맞붙은 전현직 시장인천 민심은,Politics
당 주류 부딪힌 쇄신  내로남불 타파,Politics
어렵게 영입한 박지현  용퇴등 쓴소리하자 고립화 작전,Politics
이재명 인천계양 낙관 어렵다살얼음판 걷는 심정,Politics
그룹 용퇴 박지현 비대위원장 발언 수위반발 증폭,Politics
권성동 문 정부 수석 윤종원 내정에 있을 수 없는 일 제동,Politics
강용석 승리법원 김은혜김동연 양자토론 방송 안 된다,Politics
육사 출신 약진  한미동맹 강화 기조 반영,Politics
정부 수석 윤종원 발탁 놓고 당정 난기류 권성동 에 직접 반대 의견 전달,Politics
에 정부 성명까지윤 대통령 판단,Politics
안기부 부활 예고  한동훈 영원히 장관 하나,Politics
박지현 역할 다한  용퇴 준비해야 개인 의견일 뿐혼란의 민주당,Politics
뉴스프라임 민주당 지도부 내분법무부 인사검증 조직 공방,Politics
한국리서치 이재명   윤형선 갤럽   ,Politics
정치톡톡 국정원 정치 개입 안돼  대통령 시계  학년 때 상원의원,Politics
인사검증 틀어쥔 법무부상왕 부처냐 우려 겸허히,Politics
바이든 귀국 시간 전 도발했다한미에 전략적 메시지,Politics
대통령 침실거실  관저 일 일반 공개,Politics
국민의힘 곳 확보  민주당 절반 사수 서울 구청장 선거 혈투,Politics
   첫 섞어 쏘기 도발미  전격 투입,Politics
 용퇴 박지현 후폭풍민주당 선거 코앞 파열음,Politics
전현직 대통령의 입 고민정배현진 대전 유세 맞대결,Politics
황교익 부부 합창단 사진 북한과 동급 국힘 참 안타깝다,Politics
여랑야랑이재명 선거 지면 끽  대통령 집무실 집들이  후보들의 맞춤 유세,Politics
윤 대통령 실질조치 지시향후 대북정책 강경 기조 예고,Politics
박지현  역할 끝났다민주 비공개 회의서 고성,Politics
바이든 순방 끝나자마자북한 미사일 발 섞어쐈다,Politics
뉴있저 지방선거 북한 도발민주당 지도부 파열음 민심 영향은,Politics
건희사랑 팬클럽 회장 김 여사가 직접 사진 보내와서 공개,Politics
윤석열 첫  소집한미 미사일로 공동 대응,Politics
년 만에 열린  관저침실만 대형 아파트 규모,Politics
뉴스추적 바이든 뒤통수에 도발북한의 노림수는,Politics
이슈체크 선거기간만 무사히 끝나면 전과기록 비공개,Politics
기폭장치 수차례 실험북한 차 핵실험 임박,Politics
바이든 한일 순방 끝나자북한 탄도미사일 발 연이어 발사,Politics
윤건영 평산마을 욕설시위에 병난 주민들 마냥 방치하나,Politics
만취 역주행에 사람 다치게 해도민주당 공천 기준 통과,Politics
여론보다최대 격전지 경기번 조사 중 번 오차내,Politics
우크라 부총리 다보스 특사 나경원에 한국이 전후재건 도움을,Politics
위기의 한반도 북 미사일 쏘고 핵실험 임박 움직임까지,Politics
북 바이든 귀국길에 미사일 발 발사올해 번째  발사,Politics
