titles,category
 퇴장 준비  개인 행보민주당 투톱 충돌,Politics
보궐선거  분당갑만 오차 범위 밖 계양을 원주갑 제주을은 접전,Politics
출범 보름만에 윤종원 충돌권성동 불가총리 훌륭,Politics
  도발에 핵실험 임박설까지대북제재 운명의 일주일,Politics
국정원 북한 코로나 최악상황 벗어나미사일 쏠 여유 충분,Politics
군 수뇌부 명 동시 교체육사의 귀환,Politics
 대통령 취임 후 첫  주재확 바뀐 대응,Politics
 바이든 귀국 비행 중  등 발 섞어 쏘기,Politics
한 총리 대통령 정치인 출신 아니어서 규제혁신 더 잘 될 것,Politics
이재명 정부 시작부터 절망 윤형선 계양을 지켜왔고 지키겠다,Politics
황희두  용퇴 박지현 또 때렸다노무현 정신 선택적 이용,Politics
북 화성형  발사윤대통령 첫  소집,Politics
전두환 자녀 상속포기단체 손자에 역사적 책임묻지 않겠다,Politics
송영길  오세훈 서울시장 토론회 돋보기뭐가 달랐을까,Politics
목에 손 대며 지면 끽이재명 제스처 논란,Politics
서민 조국흑서 함께 쓴 진중권 손절하는 이유는,Politics
김민석 산은 이전 반대 부산 민주당 선거 안 할 건가 부글,Politics
박지현 고립무원 빠졌나윤호중에 같이 사과하자 했더니 거절,Politics
 용퇴 발언에 파열음국조실장 인선 놓고도 잡음,Politics
박지현 노무현 정신 어디 갔나 나 왜 뽑았냐민주 자중지란,Politics
너희끼리 하세요  나도 못하겠다 차 추경안 합의안 마련 실패,Politics
여야가 보는 판세 최소  최대   최소  최대 ,Politics
년 전 풍계리 폭파 결국 쇼였나다음 도발 메뉴는 핵실험,Politics
충청남도지사 지지율 양승조   김태흠 ,Politics
박지현 어느 당 대표가 협의 거쳐 회견문 쓰나 윤호중은 비공개 회의서 책상 쾅,Politics
경기지사 지지율 김동연  김은혜 오차 내 접전,Politics
서울시장 지지율 오세훈   송영길  약진,Politics
차 핵실험 수순 밟아가는 북핵기폭장치 작동 시험 탐지,Politics
황교익  합창단 사진 동급에도 찍었다  대변인 직격,Politics
말 보다 행동 신호에 한번 보자한 격 대응 시험대 선 ,Politics
대통령실 북한 미사일 한미 향한 전략적 메시지로 판단,Politics
이준석 선거운동원 등록 이어 사전투표도 계양을에서,Politics
국민의힘 대통령실 인사에 제동여야 원구성 신경전,Politics
  도발 분만에  직접 주재 발사체 표현 지우고 미사일 즉시 공지,Politics
년만에 육사 출신 합참의장성 장군 명 전원 물갈이,Politics
인천 계양을 이재명  윤형선 오차범위 내 접전,Politics
북한 귀국하는 바이든 뒤통수에 미사일 쏜 격 섞어쏘기 처음,Politics
전원책 한동훈 소통령 논란에 바보짓법무장관 사형제 부활 논의해야,Politics
진중권 이재명 인천서 출마한 게 패착험지 안 가니 감동 없어,Politics
민주 임기 남은 해군총장 교체 인사법 정면 위배,Politics
고장 난 국회 청문회 후보자 낙동강 오리알 신세 후임 인선도 표류,Politics
 사저 찾은 이낙연 출국계획 알리고 뒤뜰 산책점심도 함께,Politics
이재명  윤형선김병관  안철수  한국리서치,Politics
바이든 선물토리 안은 사진 눈길 소박하고 아름다워,Politics
박지현 연이틀  용퇴론 윤호중 이게 지도부인가 책상 쾅,Politics
레드라인 또 넘은  차 핵실험 임박,Politics
뿔난 개딸들 트로이 목마 박지현 김건희보다 더 싫다,Politics
북 화성형  발사바이든 도착 직전,Politics
지면 정치생명 끝 일정까지 비운 이재명 위기감 엄습  지방선거,Politics
단거리 한꺼번에  한미일 동시타격 능력 과시,Politics
박지현 국민 목소리 무서운 줄 모르고지엽적인 문제로 트집종합,Politics
오늘은 절제한미 핵 자산 적기 전개 행동으로 보여주나,Politics
인사검증권까지 쥔 한동훈 소통령 반박 나선  맹폭한 ,Politics
지도부 맞나  책상 치자  전 왜 뽑았나선거 코앞 고성 충돌,Politics
김동연 측 김은혜 재산 억원 축소 신고이의제기서 제출,Politics
 사저 찾은 이낙연친문 보수 유튜버 폭언 개인 일상 파괴,Politics
레드라인 도발에  시험대한미공조 강조하며 강력 대북경고종합,Politics
이재명 계양을서 고전윤호중 부정확한 여론조사,Politics
윤호중 지도부 자격 없다 책상 쾅 박지현 날 왜 뽑아 앉혔나,Politics
이준석 이재명 맞서 윤형선 선거운동원 등록사전투표도 계양을서,Politics
국정원장 후보자 북한 비핵화 의지 없다청문회서 세월호 공방,Politics
박지현 또 작심 발언  용퇴팬덤 정치 청산민주당 내홍,Politics
수석 윤종원 국조실장 내정에  불가당정 아슬아슬종합,Politics
한덕수 윤종원 내정 논란에 우선순위는 보는 사람에 따라 달라,Politics
단독 민주당 인천공항한국공항가스공사 민영화 대상서 뺀다,Politics
국정원 김정은 집권 후 종이상 탄도미사일 동시발사는 처음,Politics
의사  간호사간호법 통과 두고 깊어지는 갈등,Politics
지방선거  여야 총력전 지도부 파열음,Politics
 대장 전원 교체연합작전 전문가합참 출신 중용,Politics
윤 대통령 시민들 초청해 집무실 안내 으리으리할 줄 알았는데 똑같죠,Politics
실거주 논란 인천 계양 윤형선 보궐선거 변수될까,Politics
국정원  풍계리 외 장소서 기폭장치 실험추가 도발 감시 중,Politics
김규현 국정원장 후보자  스스로 비핵화할 의지 없다,Politics
전두환 자녀 상속포기손자녀에게까지 역사 책임 묻진 않겠다종합,Politics
 첫 대장 인사 육사 부활군 수뇌부 명 전원 교체,Politics
대통령  경제수석 논란에도 윤종원 국조실장 임명 수순,Politics
