titles,category
회 로또 등 당첨 지역은 억씩 수도권 강세,Economic
로또 회 당첨번호 조회 등 명 중 수도권 명,Economic
논란의 제 루나 발행죽음의 폭탄 돌리기 재현,Economic
집 나간 꿈에그린 돌아왔다사라진 브랜드 고수하는 이유는,Economic
푸틴 식량 보호주의물가 고통 커지고 길어진다,Economic
빌 게이츠 테슬라 공매도에 머스크 조 안팎 손실,Economic
머스크 빌게이츠 테슬라 공매도 하더니 조원대 손실 볼 처지 조롱,Economic
신림동 광교 주민은 좋겠네신림선 신분당선 연장선 일 동시 개통 부동산,Economic
기자수첩위상 커진 카뱅 책임감도 커져야,Economic
테슬라 일론 머스크 빌게이츠 테슬라 공매도 실패로 대규모 손실 주장,Economic
머스크 빌 게이츠 테슬라 공매도로 조원대 손실 볼 처지,Economic
형님보다 아우만 전자보다 반도체 소부장주가 낫다,Economic
미국과 방산  방산에 수출교두보 될까 대미의존 커질까,Economic
내 손으로 내 재산 정리할 때이것 조심하세요 도와줘요 상속증여,Economic
선거 앞두고 조 투자 내놓은 대기업들 약속 지킬까,Economic
르포 착한 가게도 빵순이도 두 손 두 발 들게 한 밀가루 대란,Economic
보따리도로 위의 사기범들 지난해 자동차공제 보험금 억 줄줄 샜다,Economic
제의 코로나원숭이두창 테마주 갈팡질팡,Economic
벼랑 끝 한전주요국보다 싼 전기료만성적자 고리 못 끊어내,Economic
출산율생산연령인구 감소지역소멸 악순환 예고된 한국 세종픽,Economic
곳곳서 택배 파열음가격 인상에 파업까지,Economic
시그널 엔솔 이어 까지그룹 조력자 지위 굳히는 ,Economic
테라 사태 충격 속 암호화폐 시장 곳곳서 우린 달라요 진땀 해명,Economic
일회용컵 보증금제 라벨값만 만원속타는 자영업자들,Economic
전월세 시장 가뜩이나 불안한데이자부담 떠넘길라 세입자 전전긍긍 부동산,Economic
콕건강 지긋지긋한 두통 이렇게 관리하세요,Economic
이재용의 목숨 걸고거칠어진 한마디 어쩌다 나왔나,Economic
술 마시면 시동 안 걸려요음주 잠금장치 효과는,Economic
바이든 만난 더 치열해진 반도체 나노전쟁 비즈,Economic
트위터 인수하려다가 고소까지 당하고 모든게 꼬여버린 일론 머스크,Economic
지금은 현금부자만 집 산다못 버티는 영끌족 결국 김은정의 클릭 부동산,Economic
윤종원 국무조정실장직 고사여기서 물러나는 게 순리,Economic
윤종원 국조실장직 고사여기서 그치는 게 순리,Economic
벤츠 딜러도 소개 영업 출신으로 최초 임원 된  판매왕,Economic
뚝 떨어진 구매력에 기록적인 거래절벽양도세 회피 매물만 쌓인다 부동산,Economic
정권 바뀌니 기업 투자 정부에 고구마 줄기 과제 안긴 것,Economic
세계서 가장 빠른 인구감소또 꺼낸 정년연장 빛과 그림자 뉴스원샷,Economic
관악구 신림 구역 신통기획 난곡선신림선 경전철 타고 급부상 기대,Economic
년 준비했는데 또 흑역사 될까 일회용컵 보증제 운명은,Economic
국조실장직 고사한 윤종원향후 거취는,Economic
응 네 엄마 돈으로 독선적 루나 설계자의 예견된 종말,Economic
가상화폐 시장 폭락 파장 어디까지,Economic
뒷북경제 한국은행이 물가가 심각하다고 본 가지 이유,Economic
잘 나가던 인천국제도시 인방 아파트값 억억씩 뚝뚝 왜,Economic
강남권 전세매물 귀한 몸오피스텔 눈 돌리는 수요자들,Economic
말도 많고 탈도 많은 엘앤에프엇갈리는 시각,Economic
법인은 다 투기꾼입니까종부세 배 뛴 법인 주택의 항변,Economic
과 최태원 어쩐지 자주 만난다 했더니시카고학파 철학공유,Economic
걷기만 하면 돈번다믿었던 게 결국 신기루 였나 코주부,Economic
롯데백화점 핵심 조직이 강남으로 간 진짜 이유,Economic
결국 부활한 테라 코인 도박꾼들 얼마나 멍청한지 위클리 코인리뷰,Economic
반도체 기술 배우러 갔다가 스파이 취급받아 서러웠다 경제사상가 이건희 탐구,Economic
공기와도 같은 존재 반도체가 뭐기에,Economic
압도적 삼성에 우뚝 선 투자도 재계서열 따라 비즈,Economic
월세 만원인데 관리비가 만원전월세신고 꼼수 여전,Economic
북미 곳에 공장중국 추격 속도내는 배터리,Economic
벤츠르노 줄줄이 불참부산모터쇼에 무슨 일이김지희의 카스토리,Economic
기자들이 문재인 정부와 윤석열 정부를 다르게 보도하는 이유는,Economic
 기업을 병풍 아닌 파트너로 인정재계 신바람 경영뒷북비즈,Economic
윤종원 논란 부담 여기서 그치는 게 순리국조실장직 고사종합,Economic
김건희 패션 인기비결역대 영부인 패션과 다른 이것은,Economic
집피지기국토연 연구원도 보증금 떼일까 걱정 호소한 이유는,Economic
너 이것 마셔봤니맥주 이어 소주에도 부는 이색 열풍,Economic
철판값 불똥까지 튄 조선업 불안의 시간 또 치를라,Economic
농산물값이 이렇게 뛸 줄은투자수익률  대박 났다,Economic
차전지 반등하는데  뭐 사지이 종목 담겨야,Economic
한국도 인구절벽 공포통일되면 부동산 수요 늘어날까 더 머니이스트심형석의 부동산정석,Economic
조세심판례 니코틴 줄기냐 잎이냐 그것이 문제로다,Economic
머니랩 이게 요즘 한국의 매운 맛이야돌 맞은 불닭볶음면,Economic
주간리뷰인플레 파이터 나선 한은물가 전망 년만 최고치,Economic
한풀 꺾인 인플레이션에 증시 반등코스피도 반전 기대 다음주 증시전망,Economic
 출신들이 만든 팀매칭 배달앱 배달비 원 시대 연다,Economic
의술 이게 최신 생존율  폐암 치료 어디까지 왔나,Economic
인터뷰 갓생기획 김네넵 사원신발도 튀기면 맛있어요,Economic
넷플 위기설 대해부넷플 왕국 흔들가입자가 떠난다,Economic
안 그래도 금리 오르는데 열흘만에 만원 이자 차이라니,Economic
대만 반도체 사업 게 섯거라 삼성 파운드리 생태계 강화 나서나,Economic
유니콘  수난기보로노이컬리 이번엔 다를까,Economic
거리두기 해제에 예식장은 웃고 예비신혼부부는 울상 일상,Economic
루나 상폐 날짜 제각각왜,Economic
이미 요금 다 올렸는데구글 인앱 결제에 뒷북 대응,Economic
억 올라서 좋아했는데 걱정하는 영끌족 왜,Economic
큰 형님이 돌아오니 다르네추경호가 바꾼 기재부세종썰록,Economic
독감에 코로나까지 한 방에원샷 백신 언제 나올까,Economic
바이오 이번엔 대박 날까대목 앞두고 공매도 기승 돈앤톡,Economic
강북 집값에 거품 노원성북중랑 아파트 주간 가격 마이너스,Economic
유통맞수 롯데  신세계 투자전쟁에서도 한판 붙는다 언박싱,Economic
테슬라 탄 채 음주성관계목숨 담보로 한 기술 비난 폭주 백수전의 테슬람이 간다,Economic
르포치솟는 대출 금리영끌족 이자 폭탄에 팔리지도 않아부동산,Economic
셀트리온이마트 자사주 매입에 수천억 들여도 효과는 글쎄,Economic
앞으로 한국 국민연금 가입자들이 겪게 될 미래 가지,Economic
트위터페이스북 대신 링크드인에 빠진 년대생 오너,Economic
집값 하락 임계점 오나거래절벽 어디까지 깊어질까 집슐랭,Economic
종목현미경자사주 사면 뭐해셀트리온 주가는 지하실 신세,Economic
터졌다하면 수십억새마을금고 횡령 반복되는 이유는,Economic
주담대  시대 집 사기 어렵다강남은 아랑곳 안해,Economic
임금피크제 판결에 업계는 술렁,Economic
개발 기대감 커지는  주변보존이슈도 여전개방 나비효과,Economic
산업은행 부산 두고 갑론을박  떠난다  경제효과 조원,Economic
정부 출범 후 기 신도시서 첫 예안진 통과재건축 다시 탄력,Economic
미 인플레 정점 찍었다월 근원  물가지수 상승률  그쳐,Economic
서울대여의도 분분 일 신림선 개통에 인근 아파트 호가 억 폭등,Economic
포커스 이재용 삼성전자 부회장 한미 반도체 동맹 구심점으로,Economic
비행기표 비싸 여행은 아직이 업종 회복이 더 빨랐다,Economic
뉴욕증시 인플레 정점 기대감에 급등테슬라  폭등,Economic
경윳값의 휘발윳값 역전이 왜 배신인가,Economic
고작 인데 세계 시장을 주도삼성 팹리스의 승부수인더독,Economic
세계화의 종말 논쟁에서 현실로,Economic
대기업이 푼 조 돈 보따리언제 어떻게 풀릴까,Economic
프롭테크에도 혹한기 오나 투자 난항에 권고사직까지,Economic
인터뷰 박종학 베어링자산운용 대표 증시 악재 늘 있었다 이제 저평가 가치주 투자할 때,Economic
 하늘길 다시 활짝상승기류 탄 저가항공여행주,Economic
세종풍향계 친정으로 턴한 연어 차관 전성시대,Economic
네이버카카오 또 신저가 추락 거시 환경 악재실적 부진 탓,Economic
당당하다 톤 무게감경쾌하다 반전 주행감 억대 세단,Economic
웬 좌석없는 별다방 스타벅스가 쓱타벅스 된 후 생긴 일 뉴스원샷,Economic
주택오피스텔 분양권 세금차준공 이후 용도 따른 양도세율 김종필의 절세 노트,Economic
이자 깎아 드립니다은행 고정금리 주담대 세일 나선 까닭,Economic
정부의 도전끝이대로면 잠재성장률  꼴찌현실화한 인구절벽,Economic
기준금리 더 오른다는데 빚더미 앉은 대 어쩌나,Economic
인플레 정점 기대에 뉴욕증시 급등나스닥  ,Economic
서학개미픽  엔비디아 아직은 조심스럽다,Economic
구자은  회장 양손잡이 경영 시동전기의 시대 맞아 제의 도약,Economic
상암동 복덕방 부동산 시장 정중동기준금리 인상 영향은,Economic
임금피크 수렁에 빠진 기업들임금체계 원점 재검토,Economic
다음달부터 일본 여행간다 여행 관련주 기대감도 뿜뿜,Economic
경쟁력 커지는 은행 예적금만기는 년보다 개월,Economic
영끌족 이자폭탄에 비상 고정금리로 갈아탈까요,Economic
 억 집을 억 주고 샀다억 쓴 사저콜렉터 속내는 뉴스원샷,Economic
맥도날드 러시아 펀 앤드 테이스티 등으로 이름 바꾼다,Economic
이기자의 친절한 금융  적금 등장 고금리 알짜 상품은,Economic
수천억 쏟아부은 인프라로 자체 배송량 늘린 쿠팡 수익성 개선 노린다,Economic
배럴당 달러 향해기름값 질주  브레이크가 안보인다,Economic
유럽공항  늘 때 인천공항 국제선 승객  증가,Economic
우리 회사 임금피크제 위법인가 문의 빗발 노사갈등 우려도,Economic
반도체 반등 이어갈까떨어져도 저점매수 기회,Economic
저금도 꿈도 다 잃었다테라 물린 우크라인은 자살 생각도,Economic
초대형 단지 입주 차질 반시장적 분상제에 발목 잡혀,Economic
보험형 개인연금 보증이율 낮으면 이전해지 고민해야,Economic
미친 경유값에 산업계 전반 흔들,Economic
주간사모펀드 글랜우드 잇는 첨단소재 새 주인 누구,Economic
복덕방기자들윤석열 시대 청약시장은 고가점자 청약 서둘러라,Economic
물가 잡겠다지만또 오르는 금리에 이자 부담,Economic
외식업계 아르바이트 재고용 힘들어요,Economic
물류난 적신호부산항 장치장 포화,Economic
브로커가 백내장 환자 알선안과 압수수색에 세무조사까지,Economic
단독 코로나 년 동물원은 지옥이었나개체수  감소,Economic
다주택자 매물 쏟아지는데 안 팔려요집 맞교환 꼼수도 등장,Economic
정년 연장 없는 임금피크제 여 개 지방공공기관 뇌관,Economic
임금피크제 판결에 업계는 술렁,Economic
주주환원에 진심인  천억 규모 자사주 매입키로,Economic
엔솔 흥행 이끈    상장도 맡았다,Economic
증시 내부자 매수 늘었다개월간  랠리 시작오미주,Economic
퇴출될까 요금 올렸는데 뒷북 조치,Economic
이미 금겹살 된 돼지고기돼지열병으로 업친 데 덮쳤다,Economic
 기업 자사주 매입 사상 최대증시 구원자 될 것오미주,Economic
취재진에 총 겨눈 남성  어깨빵 당했다  장에 만 원  여의도서울대 분   닮은 바위  살다 보니 별일이,Economic
연이자 대 예적금 속속 등장부동산 매매는 주춤,Economic
이자 쑥에 거래 뚝영끌족 공포,Economic
깎인 월급 받을 수 있나대퇴직자들 문의 빗발,Economic
코인뉴스 비트코인 폭락 가능성에 투자심리 냉냉,Economic
순식간에 폭락한 상폐 코인 개  그런데도 규제 풀겠다고,Economic
대폭락 주만에 테라   도박으로 돈 잃고 또 도박,Economic
아프리카돼지열병 농가 확산에 금겹살 또 비상,Economic
경유 리터당 천 원 천장 뚫었다산업 현장 쇼크,Economic
외식업계 아르바이트 재고용 힘들어요,Economic
갈팡질팡 증시기관 매수에 볕드나 증시프리즘,Economic
투자 숨고르기고금리 예적금 갈아타볼까,Economic
최악 시기 지났다는데타이어 사 시기상조,Economic
구글네이버의 네모검색창은  전쟁터,Economic
롯데제과푸드 합병빙그레 꺾고  넘본다,Economic
국내 주식도 쪼개 산다증권사 온도차,Economic
명품 아니면 초저가 소비시장 양극화  ,Economic
투자뉴스 뒤풀이알쏭달쏭 투자용어헤지,Economic
고유가에 수요 파괴코로나 정점 때보다 기름 더 안넣는다,Economic
신고리 호기 냉각용 바닷물 온도제한 완화안 또 미뤄져,Economic
공기업과 지역 중견기업은 임금피크제 후폭풍 피했다,Economic
부동산 침체 지속빠르게 쌓여가는 수도권 미분양 주택,Economic
대 그룹만 년간 만명채용시장 훈풍,Economic
오후초대석 살아남는 곳은 극소수스타트업 생존 조건은,Economic
 원숭이두창 확산코로나 고위험군 검사처방 하루에,Economic
연령기준만 적용 임금피크제 무효 후폭풍 거세,Economic
사업비 조원 한남구역 재개발 롯데건설대우건설 눈독,Economic
입도선매 채용이건희의 년전 일갈 결국 사람,Economic
숫자로 본 경제 서울 올림픽 이후 가장 어두운 교역,Economic
단독 코스닥 수수료 시스템 오류 년이나 몰랐네,Economic
단독 집 주인도 모른 채 담보 연장 우리 대출 민원 가장 많았다,Economic
이 와중에 또논란의 권도형 테라 곧 출범,Economic
 천연가스 가격 여름철 앞두고 년만에 최고,Economic
원자재값 쇼크 선분양 흔들현금부자만 새집 살판,Economic
단독 제 요소수 사태 터질라 닮은꼴 원자재 수급대책 낸다,Economic
상반기 분양 예정물량의  그쳐년 후 입주도 낙관못해,Economic
임금피크제 무효 판결에 금융권도 촉각조건 개선되나,Economic
국민연금 분기 조원 손실향후 년 투자 전략은 시그널,Economic
임금피크제 모두 무효 아냐고용부 설명에도 기업들 우려 여전,Economic
금리상승기 예적금도 전략을 가져야  파킹통장도 등장머니,Economic
깎인 월급 돌려받나요노무팀노조 분주해졌다,Economic
외인기관 사자에 코스피 웃었다관광 입국 허용 항공주 강세,Economic
연말까지  더 오른다는데갈 곳없는 자금 여기 두세요,Economic
생생경제 루나테라 사태 이후 혼돈의 가상자산 시장 향후 전망 대토론,Economic
당신은 민생경제지원금 신청 대상자입니다 슬기로운 금융생활,Economic
써밋까지 꺼냈다대우건설 첫 도정 수주 임박 기업이슈,Economic
신냉전 속 식량위기 온다다보스 대 메시지,Economic
루나 닮은 이 녀석도 폭락했다내가 산 코인 폰지 논란,Economic
인출기 앞에서 스마트폰 누르면 지폐가 스르륵,Economic
 년간 자사주 천억 취득 결정배당환원 한도도 없애,Economic
마켓워치첨단소재 매각 흥행롯데솔베이알키마베어링 군침,Economic
 년만에 자사주 매입배당한도 풀기로,Economic
와인은 백화점서 구매 은 전통시장서 산다,Economic
포스코케미칼 손잡고 양극재 시장 판 흔든다,Economic
비상장 기술주 거품 빠지기 시작유동성 높은 자산으로 대피해야,Economic
삼성전자 테일러 공장 조 투자 잰걸음,Economic
하락장에  수익고배당커버드콜 뜬다,Economic
치매 치료 길 열린다연결 방해 유전자 주목,Economic
라씨로 에스에이치엔엘 상폐 앞두고 시간외 강세오늘의 시간외거래 특징주,Economic
씨티 뉴욕증시 저점 매수 때가 왔다 매경 월가월부,Economic
올인 위험 전문가 경고에도주일새 억 몰렸다,Economic
 년 말까지 자사주 억원어치 취득주주가치 제고,Economic
한 병 만원 박재범 소주 초면 완판난리 난 이유,Economic
서울 아파트 매물 개월 만에 최다,Economic
신축 아파트에 왜 이리 하자가 많아이유 있었네,Economic
상속재산 배 늘었는데여전히 공제 한도는 만원,Economic
농가소득 늘어도 농특세 계속 유지정부는 폐지 신중,Economic
대치우성차 재건축 속도내달 사업시행인가,Economic
삼성  테일러 공장 내달 착공 속도전,Economic
 기업을 병풍 아닌 파트너로 인정재계 신바람 경영,Economic
동학개미 어쩌나조 국민연금 한국주식 더 줄인다,Economic
기후변화 퍼스트 무버 안되면 낙오될 수밖에,Economic
 년 말까지 자사주 천억 취득,Economic
법조인 출신 강한승 쿠팡 사장의 황금 인맥,Economic
관가뒷담 또 떠나는 산업부 과장들 뒤숭숭한 분위기 탓,Economic
대박의 꿈 사라진 요즘만원 넣으면 만원 돌려주는 이 통장 주목,Economic
달에서 찍은 듯버추얼스튜디오 경쟁,Economic
억 투자해 조 잭팟 터졌다포스코케미칼 초대박,Economic
국민연금 내년 국내 주식 비중 더 줄인다,Economic
삼성 월 스마트폰 점유율 년 만에 최대인도 위도 탈환,Economic
김건희 여사 오늘은 만원 꿀벌 셔츠 투표소 패션 화제,Economic
기 신도시 투자한다는 장부장 이 단지 꼭 챙겨보겠네 ,Economic
목련단지포도마을삼보한라주공평촌중동산본 백조 변신할 아파트 이곳 ,Economic
취임 년 맞은 홈플러스 이제훈 사장의 성적표는,Economic
부영그룹 남양주 사랑으로 부영 월 무순위 청약,Economic
아산탕정 삼성특구 플렉스온 금일 모델하우스 오픈,Economic
국민연금 국내주식 비중 더 줄인다,Economic
 년까지 천억 규모 자사주 취득주주가치 제고,Economic
자산시장 하락세에도국민연금 향후 년 목표수익률 로 상향 조정,Economic
 증시 상승에 한국 증시도 탄력 가상화폐는 탈동조화,Economic
셀코리아 외국인 코스닥서는 샀다 엘앤에프 집중 매수,Economic
기준금리 인상에 예적금 금리 최대  대출금리도 들썩,Economic
드론으로 바다 위 선원 코로나 검사 제 감천항 사태 막는다,Economic
올해 첫 아프리카돼지열병 발생돼지고기 가격 더 오르나,Economic
고위험군 하루에 검사부터 약 처방까지내달 패스트트랙 가동,Economic
년까지 자사주 억 사들인다  주주가치 제고 정책 발표,Economic
시진핑 제로코로나 교조주의 들이받은 말년총리 리커창,Economic
 년 말까지 억원 규모 자사주 취득,Economic
페깅의 미래루나 사태후 규제만 강화될까 우려,Economic
웰스투어급변하는 금융시장 바람직한 투자전략은,Economic
기아  출시 한 달여 만에 중고차로 나왔다,Economic
감기라고 응급실로 손보 이런 꾀병환자에 전직 경찰 보낸다,Economic
코레일네트웍스 일 파업사측과 임금협상 결렬,Economic
한화 포레나 미아도 줍줍행가구 무순위 청약,Economic
머스크 한국 세계에서 가장 빠른 인구붕괴 겪고 있다,Economic
삼성증권 금리 상승기 사면 좋은 주식은요,Economic
폭락 수습도 않고 테라  강행또 개미지옥 경고 나왔다,Economic
재입고 언제소상공인 수제작 김건희 가방 금세 품절,Economic
용산 년차 빌라 억억서울 집값 들썩 거래량 보니,Economic
연준 부의장 각국 디지털화폐 발행 뒤처질 수 없다,Economic
공단 한복판에 들어선 유니클로역발상 전략 통했다,Economic
 년 말까지 천억원 규모 자사주 취득주주가치 제고,Economic
 년까지 억 규모 자사주 취득 결정,Economic
인뱅 분기 중저신용자 비율 뛰었다토스뱅크 도 넘겨,Economic
 화끈한 자사주 매입억 쏜다,Economic
다둥이 아빠 머스크 한국 출산율 경고,Economic
 자기주식 억원 취득 결정배당환원 한도도 없애,Economic
 주주가치 제고 나선다천억 원 자사주 취득,Economic
태양광 볕드나현대에너지솔루션 거래일 연속 상승하며 연일 강세,Economic
 주주가치 제고 위해 천억원 자기주식 취득 결정,Economic
현대그룹 회복 시동 걸었다 하반기 기대,Economic
마켓워치국민연금 분기 말 누적 수익률 ,Economic
부실 공기업 순위 한국전력 이끄는 정승일 사장은 누구,Economic
마켓워치넥스플렉스 인수전에  등판,Economic
원달러환율 원대로 뚝전날보다 원종합,Economic
코스피 반도체주 반등으로 상승선 마감,Economic
년 전 상승률 위서 하락률 위로세종 집값 하락 지속,Economic
금융권에 당근채찍 동시에 던진 김소영 부위원장,Economic
인터넷은행 중저신용자 대출 비중 증가막내 토스뱅크가 위,Economic
코스피  상승 백악관 초청에 하이브 주가오늘의 증시경향,Economic
현대현대일렉현대건설기계 등 작년도 임금협상 타결,Economic
머스크 이번엔 정치인  억만장자 누굴 더 못믿는가 설문,Economic
국내외 증시 부진 국민연금 분기 수익률 ,Economic
만원 근접한 하이닉스저가 매수 기회  반등 이르다,Economic
단독 추경호 취임 후 첫 경제단체장 회동이재용 사면 논의될 듯,Economic
물가 잡으려다 대출자 등골 휜다갱신 이자 부담 어쩌죠,Economic
이광재 강원도 바다가 있는 스위스로인구소멸지역 가구주택 추진,Economic
이임식 준비 했는데 기업은행 윤종원 논란에 난감,Economic
 넘어 대하반기 물가 상승률 때 넘어서나,Economic
작년 월 이후 차례 금리인상주택시장 이자부담 눈덩이,Economic
역직구로 투잡 뛰는 직장인들월급보다 더 낫네,Economic
일일 청약홈에서 숭의역 엘크루 무순위 청약 진행,Economic
조원대까지 늘어난 일평균 대차잔고하락장 이어지나,Economic
연구개발 강화하는 제약바이오업계대웅제약 신약 개발로 성장동력 확보,Economic
 로또 지역 무슨 일인덕원 아파트값 억 훅 떨어졌다,Economic
미국 소비침체사치품저가 할인용품 판매는 늘었다,Economic
 년 만에 시총 조 돌파디지코 통했다,Economic
셀트리온 형제 살아났나본업 집중하니까 주가도 상승,Economic
동네 빵 맛집 다 모았다현대 빵돌이빵순이 취향 저격,Economic
코스피 외인기관 사자 상승 마감반도체주 강세,Economic
삼성전자  테일러 공장 내달 기초공사 시작년 가동,Economic
 정부서 홀대받던 원전사업  정부서 부활기업들 재시동,Economic
영상만원 위태 하이닉스 바닥구간 손절기준,Economic
코스피  가까이 올라 선 회복기관외인 매수종합,Economic
대 그룹 절반 에너지에 미래 걸었다조 투자,Economic
특급호텔 이젠 망고 디저트 시대 언박싱,Economic
또 없어지네하반기에도 지속되는 은행 점포 폐쇄,Economic
한진 일가 억 원대 양도세 취소 소송서 최종 패소,Economic
삼겹살 가격 더 오르나강원 홍천서 돼지열병 발생,Economic
영부인이 드신 것 맞나요김건희 백 또 품절 대란 오나,Economic
조현준 효성 회장 부친 이어 대째 한국의 경영자상 수상,Economic
합병되는 롯데푸드순혈주의 깬 이진성 대표 거취는,Economic
수그러든 달러 강세환율 원 넘게 하락하며 원 마감,Economic
단독 년 뒤 서울 새집 가구 뿐최악 공급 한파온다,Economic
인도 수출 제한에 밀가루설탕 매출 한때수급 문제 없어,Economic
시중은행 신용대출 연  시대눈덩이 이자에 빚부터 갚자,Economic
한진 총수일가 억 원대 양도세 취소소송서 최종 패소,Economic
핫스탁하이브플레이위드이글벳종합,Economic
항공주 일제히 급등일본여행자금수혈 겹호재,Economic
기업가치 조 원 당근마켓 눈덩이 적자 탈출은 과제,Economic
부동산 서울 아파트값  전세값 ,Economic
외환마감달러화 약세환율 거래일만에 원대 하락,Economic
한국공인중개사협회 임대차신고제 계도 기간 연장 환영,Economic
코스피 마감경기우려 완화에 약  상승외인 연일 사자,Economic
   주관사에 모간스탠리 등 곳 선정,Economic
대기업 투자계획 깜깜이경제개혁연대 거래소 조회공시 요구해야,Economic
