titles,category
단독공사중단 둔촌주공 시공사업단 법원 답변서 제출변호사 선임 등 절차 진행,Economic
통합공공임대 입주자격 기관마다 정한다신희타 자격도 완화,Economic
다음 달 일부터 관광입국 허용하나투어 등 여행관련주 상승,Economic
롯데제과푸드 합병 승인국내 위 식품기업 도약 빙과사업 위 탈환,Economic
포스코케미칼 캐나다에 양극재 합작공장 설립,Economic
배터리 사 기술로 승부수연구개발비 채용 적극 확대,Economic
코스피 외국인기관 사자에 상승 마감반도체 강세 영향,Economic
금감원 억 횡령 우리 검사 또 연장배경은,Economic
이앤씨 서수원 편한세상 시티 고색 월 공급,Economic
대기업 천조원 투자거래소 투자자 위해 조회공시 요청해야,Economic
경제 토론 임금피크제 무효에 비상등 켜진 기업신규채용 차질없나,Economic
가상자산 리딩방 수익률 보장에 속은 투자자들억 날려,Economic
한은 총재 이어 추 부총리도 물가 대 상승 공식화,Economic
고용부 정년유지형 임금피크제 모두 무효 아냐,Economic
만명 가입 페이코인 당국 허가 대기업계 시세 조정 우려 있다,Economic
유럽이 인정한 안전성기아  유로앤캡 최고 등급 획득,Economic
단독만원짜리 지갑 반품비 만원공정위 명품 플랫폼 사 조사,Economic
연봉  월급제 라이더 뽑는 배민 속내는,Economic
보금자리론 금리 또 인상 년 만기 ,Economic
건설 부산 강서자이 에코델타 견본주택 오픈,Economic
잘나가는 데이터센터용 반도체삼성하이닉스 위 굳건,Economic
수율  밖에테슬라 배터리 독립이 어려운 이유 셋,Economic
추경호 물가 일정기간  넘을 듯 과도한 금융규제 과감히 정리하겠다,Economic
잇따른 대기업 대규모 채용계획 발표숨죽인 임원들 나 떨고 있니,Economic
중 악재 겹쳤다삼겹살 겹살 될 판 비명,Economic
석유 매장량보다 반도체 확보가 더 중요반도체 공급망 아시아 의존도 낮춰야,Economic
단독 현대차 울산공장 주간 휴업아이오닉 생산중단,Economic
스타필드의 수혜가 기대되는 레이크필드 운정 위버젠,Economic
불참이 미덕이었는데결혼식돌잔치에 부담백배,Economic
여름은 시작도 안 했는데 전력 예비율 선 위태,Economic
인뱅 중저신용 대출 빠르게 증가 위는 토스뱅크,Economic
미국 유통업체 실적에 드러난 양극화월마트는 떨어졌는데 달러트리 실적 왜 좋아졌을까,Economic
테일러 공장 착공 임박조 실탄 삼성전자  추가 투자 또 할까,Economic
돈은 물론 건강까지 관리 헬스케어 기업과 손잡는 금융사들,Economic
코인브리핑 뉴욕증시 상승에도 비트코인은 하락,Economic
공인중개업계 임대차 신고제 계도기간 년 연장에 환영,Economic
이앤씨 인천 편한세상 시티 항동 마리나 분양중,Economic
나스닥 호조에도 비트코인이더리움 하락 다보스 포럼에서 가상자산 비판 일색,Economic
현대카드 거리두기 해제에 월 항공결제 ,Economic
국민연금도 하락장 못 피했다수익률 석 달째 마이너스,Economic
서민 정책대출 너마저월 보금자리론적격대출 최고 ,Economic
시그널  대어   대표 주관사 증권 낙점,Economic
기아  유럽 신차평가 프로그램에서 별 개 획득,Economic
사룟값 급등 발생에 삼겹살 가격 더 오르나,Economic
삼성이 조 들여 짓는  테일러 공장바이든이재용 다시 만나나,Economic
토스뱅크 입사 주년 직원 명에 스톡옵션 부여,Economic
물타기하다 어느덧 억 년간  손실  개미의 눈물,Economic
국민연금  수익률  글로벌 연기금 중에선 양호,Economic
단독 푸르덴셜생명 첫 자회사 대표에 김정수 상무 내정 내부 출신 중용,Economic
분기 인터넷은행 중저신용자 대출 비중토스뱅크  위종합,Economic
월급만으로 살기 힘들다성인 명 중 명 초단기 알바 경험 ,Economic
두산에너빌리티  자회사 밥콕 프랑스 알트레드에 억 매각,Economic
뜨거운 감자 최저임금  업종별로 차등 적용해야,Economic
영국 셸 인도와 사할린 사업권 매각 협상중국도 기웃,Economic
엑스틴세대 전기차리스에 반하다,Economic
 근로자 절반 년 안에 이직할 것올해도 대규모 퇴직 이어진다,Economic
서울 아파트값 왜 이러지 주간 통계 민간 상승 공공 보합,Economic
 정부와 선 그은 김소영 금리배당 등 금융사 자율성 최대 보장,Economic
항공 빅딜 큰 변수는 중국 목소리,Economic
실패해도 괜찮아삼성전자 랩 스타트업 지원 성과 보인다,Economic
호반건설 인천 영종국제도시 호반써밋 스카이센트럴 차 분양,Economic
서울 아파트 매수심리 주 연속 하락,Economic
금겹살에 돼지열병까지 발병물가상승 부채질 우려,Economic
이노엔 엑소좀 기반 신약 개발 착수,Economic
예전만 못한 줍줍 인기 일각선 청약 자격 제한 풀어야 논란,Economic
글로벌 근로자 명중 명 년 내 이직 고려,Economic
중국과 거리두기 시작한 애플상하이 봉쇄 이후 글로벌 기업 중국 행렬,Economic
여기도 오픈런이 여주 프리미엄 아울렛 가보니 현장르포,Economic
더현대 서울 성공 진두지휘 정지선 회장 올해 경영자상,Economic
농식품부 아프리카돼지열병 발생에도 돈육 공급 차질 없어,Economic
조원 투자 발표한 대기업에 정부 법인세 인하로 화답하나,Economic
 교역조건 개월째 악화서울올림픽 이래 최악,Economic
토스뱅크 분기 중저신용 대출 비중 업계 중 유일하게  돌파,Economic
억원 횡령 우리은행 직원동생 다음 달 일 첫 재판,Economic
삼성전자 노조 바이든이재용 방진복 왜 안 입었나 사측에 항의 공문,Economic
해외 콘퍼런스서 본 코인 시장테라 회복 어렵다 비트코인이더리움 대세론,Economic
우리 이혼했어요 외국계와 갈라서는 운용사들 의사결정 복잡필요성 모호,Economic
양극재 동맹 강화 포스코케미칼 과 합작사 얼티엄캠 설립,Economic
롯데제과롯데푸드 주총서 합병 정식 승인,Economic
롯데제과롯데푸드 주총서 합병 승인국내 위 종합식품기업 탄생,Economic
임금피크제 무효 판결 정년 근로자 많은 조선철강차업계 긴장,Economic
삼성전자 분기 기업용  시장 점유율  압도적 위,Economic
 선전시 전자제품 보조금 삼성전자 등 외국 브랜드는 제외,Economic
수익률 하락 위기 국민연금 위험자산 투자 확대 왜 시그널,Economic
건설 강서자이 에코델타 견본주택 일 오픈,Economic
카카오뱅크 분기 중저신용 대출 비중 억 공급,Economic
인터넷은행 사 분기 중저신용자 대출 비중 일제히 상승,Economic
분기 인터넷은행 중저신용자 대출 비중토스뱅크  위,Economic
인뱅 중저신용자 대출 비중  돌파토뱅  최고,Economic
정부 대법 판결 정년유지 임금피크제 모두 무효는 아냐,Economic
순익 하락한 대형 보험대리점 업계 성장세 꺾였나,Economic
뉴스외전 경제 쏙 여행외식비 빠른 속도로 감소 가능성소비 침체 후폭풍,Economic
삼성전자 다음달  테일러 파운드리 공장 착공 예상,Economic
기아  유럽 신차 안정성 평가서 최고등급,Economic
공인중개사협회 임대차 신고제 계도기간 연장 적극 환영,Economic
몰디브 슈발블랑도 부러워 할 스카이 카바나를 가진 루시아 청담  더리버,Economic
추경호 부총리 불필요하고 과도한 금융 규제 과감히 정비종합,Economic
금리 더 오른다는데자영업   이자 부담 어쩌나,Economic
고용부 모든 임금피크제 무효 아냐현장 혼란 최소화할 것,Economic
대우건설 대구 달서 푸르지오 시그니처 분양,Economic
치매 퍼즐놀이만 할 게 아니었네근육 부족해도 걸린다,Economic
북미 향하는 국내 배터리사 올해만 조원 투자,Economic
국제선 여객수 만명 임박삼중고 항공업계 항공편 너무 부족,Economic
기준금리 인상에시중은행 예적금 금리 잇따라 상향,Economic
강원 아파트 분양가 평당 만원 돌파년 새  올라,Economic
카카오뱅크 중저신용 조원 무보증 신용대출,Economic
달라진 확진자 투표양성 통지 문자 원본 꼭 챙겨야,Economic
천정부지 배터리 원자재원료구입비 작년보다  늘어종합,Economic
지친 마음 한구석에 고길동이 찾아올 때어른이는 지갑을 열어,Economic
연소득 한푼도 안 쓰고 서울 집 사려면년 년 년 무엇이 맞나요 부동산,Economic
포스코케미칼 과  설립전기차 만대분 양극재 만든다,Economic
장외시장 큰손 떠오른 자이낸스세대비상장주식 투자자 가 대,Economic
마켓인국민연금 월 말 운용수익률 ,Economic
탈원전 년 쇼크 원전 부품사들 복원하려면 빨리,Economic
모건스탠리 한은 금리 번 더 올릴 것연말 ,Economic
대전스카이자이르네 주상복합 아파트 미래가치 높은 동구 일대에 공급,Economic
고유가에 수입가격 치솟아교역지수 역대 최저,Economic
카카오뱅크 분기 중저신용 대출 비중 총 조원 공급,Economic
건설 강서자이 에코델타 견본주택 개관,Economic
임금피크제 제동에 희비 엇갈린 노사재계 우려 노동계 환영,Economic
서울 마포구 일대 빌리브 디 에이블 분양 진행,Economic
삼성전자 테일러 공장 다음달 착공이재용바이든 또 만날까,Economic
하이닉스 나올만한 악재 다 나왔다분할매수 시점,Economic
윤종원 국조실장 논란에 기업은행은 올스톱,Economic
금융위 입김에도 억 밖에 차입 막힌 대부업 프리미어리그 위기,Economic
년 마다 바뀌는 수원 부동산 전통 동쪽 지고 신흥 서쪽이 뜬다,Economic
개월만  발생돼지 공급량 역대최고가격 안정책 추진,Economic
정부와 같은 개입 없다당국 금융사 자율성 보장하기로,Economic
포스코건설 경남 더샵 거창포르시엘 차 월 분양,Economic
용산 강남 재건축 단지 아파트값 상승 견인서울 ,Economic
거래일간  상승 위메이드맥스 개미 이번에도 올라탈까,Economic
이노엔 원형탈모 치료제 반사이익엑소좀 신약 겹호재에 주가 방긋,Economic
고준위 방폐물 처분 특별법 제정 시급,Economic
종부세법 개정안 공정가액비율 폐지 꼼수증세 우려주택자도 영향권,Economic
중앙감염병전문병원 미 공병단 부지에 들어선다년 완공,Economic
서울 아파트값 용산강남 고가 아파트가 상승 주도,Economic
저축은행도 예적금 금리 인상한은발 인상행렬,Economic
착공 앞둔 삼성전자  테일러시 공장사진 공개,Economic
경제읽기 기준금리  이자 부담 가중부동산 시장 찬바람,Economic
롯데제과푸드 합병 승인국내 위 식품기업 탄생,Economic
시민들 즐기던 서면경마장 역사 속으로근현대사 부침 담긴 부산경마,Economic
추경호 물가 녹록지 않다 대 숫자 보게 될 것,Economic
대법원 임금피크제 무효 판결에 경영계 청년 일자리 위축 우려,Economic
경유값쇼크경유의 배신 산업계 덮쳐대체재 없는 막다른 골목종합,Economic
경유값쇼크도대체 왜 올랐나종합,Economic
코로나 전보다 잘나가여행보다 회복 빠른 리오프닝 수혜 업종은,Economic
하이닉스 찔끔 반등했지만낸드 시장점유율 추락에 휘청,Economic
보령 내달 혈압강하 효과 개선한 고혈압 제 복합제 출시,Economic
디와이디 삼부토건 인수 순항 중도금 지급 완료,Economic
헝셩그룹  상하이 봉쇄 해제 임박에 급등,Economic
모건스탠리 한은 연내 회 금리 인상연말  전망,Economic
포항북구 우현동에 빅브랜드 아파트 들어선다,Economic
매머드급 지식정보타운 조성 기대 금정역 차  센터 공급 눈길,Economic
테라  부활 강행국내 거래소들 상장 계획 없어,Economic
신림선 개통에 들썩이는 서울 서남부매물 거두고 호가 억 껑충,Economic
둔촌주공 분쟁에 정부가 직접 개입 마라 권영훈의 집중탐구,Economic
서울 아파트 매물 년개월 만에 최다매매수급지수 주째 하락,Economic
강원서 올해 첫 아프리카돼지열병 발생접경지 방역 초비상,Economic
추경호 물가 상승률 일정 기간  넘을 듯과도한 금융 규제 과감히 정리,Economic
판 커지는 소형 에어컨 시장삼성 신제품 앞세워 참전종합,Economic
믿고 보는 코스트코 월마트와 달랐다 분 미국주식,Economic
맑은 날씨에 나들이 차량 몰려 곳곳 혼잡주말휴일 고속도로,Economic
동양건설산업 화성 봉담 파라곤 본격적인 일반분양 돌입일 특별공급 내달 일 순위 청약,Economic
뭔말이지 베이비스텝 빅스텝 자이언트스텝,Economic
잠잠하던  개월 만에 또 발생장바구니 물가 또 오르나,Economic
모건스탠리 한은 기준금리 연내 번 추가 인상연말 예상,Economic
확진 연이틀 만명대총리 고령층 당일 검사처방,Economic
레이디스 앤 젠틀맨이 성차별이라고서구권 항공사서 속속 퇴출,Economic
기자수첩 제의 타다 될뻔 한 로톡의 구사일생,Economic
지방 비규제 아파트 편한세상 제천 더프라임,Economic
유가 상승에 수입금액 치솟아 교역지수 역대 최저,Economic
강서자이 에코델타 견본주택 인기 좋네,Economic
 신속심사 한미약품 포지오티닙 임상 상도 시작,Economic
송도의 모든 인프라를 한걸음에 송도 센트럴비즈 한라,Economic
정지선 현대백화점그룹 회장  한국의 경영자상 수상,Economic
세대 겨냥한 생활숙박시설 신라모노그램 강릉 완판 앞둬,Economic
추경호 금융권 불필요한 규제 과감하게 정비할 것,Economic
단독 탈원전 뒤집기 시작에너지기본법 만든다,Economic
새 루나코인 무상지급 하지만대 거래소 상장은 아냐,Economic
최고 대  청약 경쟁률 기록 힐스테이트 양주옥정 파티오포레 전 타입 마감,Economic
금리인상규제완화집값 양극화 너머 파편화,Economic
기업용  시장 커진다점유율 위 삼성가 주도,Economic
풍향계 통큰 투자 이재용정의선조직문화 쇄신 조주완,Economic
주택금융시장 주춤상업시설로 수요 관심 이동,Economic
금융수장들 만난 추경호 불필요과도한 규제 과감히 정비,Economic
부터 모터스포츠까지대한통운 비인기 스포츠 종목 저변 확대 나서,Economic
원자재 가격 상승에 수입가격 뛰면서 교역조건 역대 최악,Economic
추경호 금융규제 과감히 정비경제 엄중 물가 대 보일 것종합,Economic
삼성전자 미국 테일러 파운드리 공장 건설 본격화내달 착공,Economic
수출가격보다 수입가격 더 크게 오르면서 교역조건 역대 최악,Economic
추경호 불필요과도한 금융 규제 과감하게 정리할 것,Economic
무디스 한국 경제성장률 전망치 로 하향 조절왜,Economic
전기 리스 큰 손으로 떠오른 엑스틴 세대,Economic
원자력수소업계 원전 활용 청정수소 상용화 추진,Economic
군포 한라주공단지차 아파트 재건축 예비안전진단 통과,Economic
코스피코스닥 상승 움직임페이퍼코리아 이틀째 약세 흐름,Economic
완성차업체 중고차 판매 시작하면 시장 선순환,Economic
매파 한은에 화들짝파리바 연내 번 더 금리 인상,Economic
정부 서울 방산동  공병단 부지에 중앙감염병전문병원 건립 추진,Economic
년전처럼 한미 금리역전 감내 가능지금은 다르다,Economic
지난 년간 소외감 컸었는데 대통령 관심에 활기찾는 ,Economic
데스모이드 임상 자진철회한 메드팩토희귀의약품 공략 전략 수정,Economic
연말까지 번 더 올린다기준금리  예상,Economic
포스코케미칼 과 북미 진출캐나다에 얼티엄캠 설립,Economic
내달부터 코로나 고위험군 패스트트랙 도입하루 내 검사진단처방,Economic
김소영 금융위 부위원장 은행 자영업자 채무조정청년 규제완화 도와달라,Economic
재계 투자 핵심 키워드는 ,Economic
현대차포스코두산 뜨니가스 최대행사가 수소총회로,Economic
효성중공업 서초동서 합리적인 분양가 책정 디오페라 서초 해링턴 타워 공급,Economic
김소영 부위원장 전 정부 개입 과도금리배당 자율성 보장,Economic
대 금융지주 만난 김소영 지난 정부 규제 과도금리 등 자율성 최대 보장,Economic
기아  유럽 신차평가 인증기관서 최고 등급 ,Economic
코로나 불안우울이제 모바일로 정확히 진단받는다,Economic
거리두기 해제 상권 회복 속  몰 개장,Economic
현대건설 서울 전입인구 증가하는 인천서 힐스테이트 불로 포레스트 내달 공급,Economic
코로나 충격에 중국 월 공업이익  감소,Economic
수출가격보다 수입가격 더 크게 오르자 교역조건 역대 최악,Economic
수출가격보다 더 뛴 수입가격에 교역조건 역대 최악,Economic
월 교역조건 역대 최악고유가에 수입액 급증 탓,Economic
고유가에 치솟은 수입가격 교역조건 개월째 악화,Economic
안양시에서만 번의 성공으로 검증된   바톤 잇는 금정역 차  센터 공급,Economic
년 서울올림픽 이후 최악유가 급등에 교역조건 뚝,Economic
성공예감 물가 환율진정 국면에 들어섰다  이종우 이코노미스트,Economic
물가 잡으려다 서민 이자 부담 가중저소득층 위한 정책 뒷받침돼야,Economic
다주택자만 혜택 규제 완화 딜레마,Economic
추경호 경제 굉장히 엄중새정부 경제정책방향 월 발표,Economic
포스코케미칼 캐나다에 양극재 합작공장 건립 억원 투자,Economic
에어프레미아 월 인천싱가포르 여객 국제선 첫 취항,Economic
한은 금리인상시중은행 예적금 금리 줄인상,Economic
롯데제과 롯데푸드 합병 승인롯데제과 빙그레 제치고 업계 위,Economic
위메이드플레이 자회사 합병 통해 연 매출 억 개발사 탄생,Economic
년 만에 결론휴일특근 파업 업무방해죄 처벌 합헌,Economic
묻지마 임금피크제 대법서 제동기업들 비상,Economic
모다모다 잘나가는 이유 있었네유일한 자연 갈변 샴푸,Economic
야속한 증권업계받을 이자는 껑충 내줄 이자는 찔끔,Economic
포스코케미칼 과 캐나다에 양극재 합작공장 건립,Economic
카드값 밀리면 신용점수 곧바로 떨어지나요,Economic
손실보전금 지급 지방선거 전이냐 후냐추경 막판 진통,Economic
추경호 부총리 불필요하고 과도한 금융 규제 과감히 정리,Economic
일본 여행길 다시 뚫리자 여행주 일제히  전후 상승세 증시이슈,Economic
롯데제과롯데푸드 합병 승인조천억 종합식품기업 탄생,Economic
연이자 만원 불어나는데물가는 치솟고 월급은 그대로,Economic
한달간 비 한방울 안내렸다봄가뭄에 밭작물 타들어가,Economic
권도형 테라  부활 강행국내 거래소들 상장 계획 없어,Economic
인도 밀설탕 이어 쌀 수출 금지할수도시간 문제,Economic
만원 반지도 온라인서 산다남성들이 더 열광하는 까닭,Economic
한독 첫 이르베사르탄암로디핀 조합 고혈압약 임상상,Economic
기아  하이브리드 현대 그랜저 턱 밑까지 추격,Economic
긴축 진정 기대감코스피 삼천 재진입,Economic
드디어 쏟아내나 서울 아파트 매물 년 개월 만에 최다,Economic
현대건설 둔촌주공에 못 받은 돈 천억대우현산롯데도 속앓이,Economic
매물만 쌓이네 서울 아파트 매매수급지수 주째,Economic
임금피크제 위헌 판결에은행권 난감,Economic
서울 강북구 분양단지 모두 줍줍한화포레나미아도 무순위 청약,Economic
대기업 취업문 활짝대 그룹 년간 만 명 뽑는다,Economic
단독삼성전기 수원사업장  고층 빌딩 추진,Economic
모건스탠리 한은 기준금리 연내 번 추가인상연말 예상,Economic
휘발유경유 나란히 천원 돌파전기차 몸값 더 오르나,Economic
코스피 장중 선 등락원달러 환율 원대,Economic
초 완판 브랜드 사이서 난리 난 그 옷 뭐길래 박종관의 유통관통,Economic
롯데제과푸드 임시주총서 합병 승인국내 위 식품 기업 도약,Economic
금리인상 더 남았다고취약층 잠이 안온다,Economic
쿠팡 와우 멤버십 만 회원 시대 여나,Economic
기름값 천정부지휘발유경유 다 천원 넘었다,Economic
주식 초고수는 지금 리보세라닙 성공 기대감에생명과학 매수세 집중,Economic
인플레에 발목 잡힌 ,Economic
테라  부활 강행국내 거래소들 상장 계획 없어,Economic
국민 다수가 원하는이재용 부회장 빠른 사면 필요 터뷰  이찬희 삼성 준법감시위원장,Economic
