titles,category
변협로톡 싸움 헌재는 로톡 손 들어줬다광고금지 위헌,Social
항체치료제 이부실드  변이에 중화활성 유지,Social
헌재 강원랜드 권성동 공모 혐의 김재홍 차관 기소유예 취소,Social
민주당 이중적 모습김은혜는 소신있는 정치인 되겠다,Social
무투표 당선 군산시의원 후보 음주운전에 당선 날아가,Social
노관규 후보 사퇴 촉구성 이용해 정치하는 사람 녹취록 파문,Social
치킨집 취업시켜줄게실업급여 억 타낸 전문브로커 구속기소,Social
명 실종 스텔라데이지호 검사원 무죄 확정대책위 실망,Social
이학수 정읍시장 후보 넥실리스 배터리 부품공장 유치,Social
아파트 도색 갈등에 멍든 주민자치입주자 대표가 재물손괴,Social
법무부 검수완박 법안 대응  가동팀장에 윤원기 부장검사,Social
택배 상하차 도중 휴대전화 대 훔쳐 외국인 노동자 명 덜미,Social
대 의붓딸 성폭행한 대 징역 년형 선고,Social
공수처 공소시효 놓친 검사에 증거 불충분 무혐의 처분,Social
임금 주지 않는다며 흉기로 선주 협박 대에 실형 선고,Social
이석윤 후보 선거운동 중 만취 시민 안전 귀가 도와,Social
음주운전 군산 무투표 시의원 당선자 민주당서 제명내년 재선거,Social
박순애 교육부 장관 후보자 교육계는 기대와 우려 교차,Social
한동훈 법무부 첫 인사검증 대상은 경찰청장경찰 견제 수단 되나,Social
부산 아파트 건설 현장 지나던 여성 펜스에 깔려 다쳐,Social
에코델타시티 사업비 억 빼돌린 직원 징역 년,Social
분도 안 걸려요부산창원 택시비 만천원 먹튀 한 승객,Social
군위선관위 허위로 거소투표 신고한 이장 검찰 고발,Social
지방선거 여야 용인시장 후보 선거운동 과열 양상,Social
헌재 강원랜드 채용비리 산자부  차관 기소유예는 잘못 헌법소원 인용,Social
위안부 합의 관련 외교부 문건에 국장이 윤미향 만나 설명종합,Social
대학교수노동계 등 잇따라 김영록 후보 지지선언,Social
수수료 싼 일반 여권도 일부터 발급수수료 만원,Social
이근 귀국 앞두고 인터뷰 작전 중 양쪽 무릎 부상 러 범죄도 목격,Social
이근 아직 우크라에 있다악에 맞서 싸울 수 있어 기뻐,Social
창녕 산불 발생산림당국 현재 진화 중,Social
남편에게 예비군 통지서 전달 안한 아내 처벌은 위헌,Social
배현진 통영고성 지원유세 지역의 심장을 다시 뛰게,Social
수입승용차 훔진 대 인조 절도범 붙잡혀,Social
통영 케이블카 궤도운송법 어겨 허가취소 위기,Social
변호사 로톡 광고 금지 변협 규정 일부 위헌로톡 헌재에 경의 표한다,Social
경기 기초단체장 판세는 최소 곳   과반 사수,Social
개 시군 농촌 빈집 침입해 억여원 상당 금품 훔친 대 구속,Social
계곡 살인 이은해 딸 입양 무효 소송 수원가정법원으로 이송,Social
한변 외교부 국장 윤미향 만나 한일 위안부 합의 설명 문건 공개,Social
헌재 민주당만 빼고 칼럼 선거법 위반 판단기소유예 정당종합,Social
년만에 잇따른 대면 축제로 대학가 들떠부작용도 속출,Social
다시 안 만날거면 같이 죽자 전 여친 감금한 대 집행유예,Social
연령만 적용한 임금피크제 위법 대법원 판결 파장은,Social
경남노동계 대법 임금피크제 무효 판결 환영전면 재검토해야,Social
글중심 차별 논란에 윤 대통령 여성 명 임명 여론 들어 잘한 인사 구색 맞출 필요 없어,Social
불법체류 외국인 서 만원 뽑다가 현행범 체포,Social
내달 일 올해 첫 모평 명의 전문가가 말하는 국어 필승 전략은,Social
경찰차 사이에 곤히도로서 잠든 차량 잡고보니 무면허 영상,Social
수사기밀 유출 현직 판사헌재 검찰 기소유예 처분 취소,Social
자막뉴스 대낮 만취한 트럭 인도로 돌진행인 명 날벼락,Social
광교에서 신사까지 분신분당선 강남신사 구간 일 개통,Social
임태희 진보교육감 심판론 시 등교혁신교육 비판 공세,Social
귀국한다던 이근 아직 우크라이나악에 맞설 수 있어 기뻐,Social
김학의 불법출금 차규근 측 직위해제 부당소청심사청구 제기,Social
모멘트 대법원 합리적 이유 없는 임금피크제 무효,Social
너희같은 가난한 년놈들 고깃집 갑질 모녀우리딸 어려공론화 억울해,Social
헌재 윤창호법 또 위헌반복적 음주측정 거부 가중처벌 과해,Social
만원 보이스피싱 막은 원주 농협직원 경찰 감사장,Social
이장님 계세요 부재 확인 후 상습절도 대 덜미,Social
대 의붓딸 성폭행한 인면수심 대 징역 년 선고,Social
인천 주민단체 대통령이 인천공항 민영화 반대 표명하라,Social
대낮 가정집 침입한 대 비상계단서 현관 비번 훔쳐봤다,Social
해병대 부사관 성추행 년 반 방치하다 늑장 조사,Social
 과학방역 강조에질병청 슈퍼컴 도입해 유행 예측,Social
광교에서 신사까지 분신분당선 강남신사 구간 일 개통,Social
법무부 검찰 수사권 축소 대응  헌법재판 준비 전담팀 구성,Social
 만 원 최고급 독도새우 울릉도 바다 방류,Social
수사 정보 유출 서부지법 판사 기소유예 헌재  중대한 법리오해,Social
년 공직 마침표 김강립 식약처장 중력이산 한마디,Social
대낮에 사람 치고 줄행랑운전자 검거하니 역시 음주 영상,Social
민주당만 빼고 임미리 교수 칼럼 헌재 선거법 위반,Social
교부금은 감축되고 등록금은 인상될까,Social
다시 만나줘 헤어진 전 여친 시간 차에 감금한 대 집행유예,Social
헌재 변호사 플랫폼 가입금지 변협 광고규정 일부 위헌종합,Social
대낮에 주인 없는 아파트 침입한 대 남성 구속,Social
문재인 매곡마을 사저 매입자 알고 보니 대통령 집 컬렉터,Social
결핵 환자 년새  줄었지만 여전히  위 결핵발생국,Social
