titles,category
단독조희연 다녀간 뒤 매주 화요일 선거 회의 열려,Social
이슈체크 대법 임금피크제 가지 원칙 제시줄소송 예고,Social
뉴있저 대법 임금피크제 위법헌재 윤창호법 위헌,Social
윤창호법 위헌으로 효력 상실대체 후속 입법 시급,Social
나이 많다고 월급만 깎는 임금피크제는 불법파장 클 듯,Social
대법 합리적 이유 없는 임금피크제 무효재계 비상,Social
사랑의 징검다리 아픈 몸으로 초 아들 키우는 영웅 엄마,Social
전자발찌 끊고  명 살해한 강윤성 계획 살인 아니었다,Social
파업 업무방해죄 처벌 또 합헌위헌 정족수 명 부족,Social
조병국 파주시장 후보 지하철 호선 파주연장 재정사업으로 조기 추진,Social
북해운대연제까지 구청장 후보 공방전,Social
대통령 집무실 경비 경비단서 실탄 발 분실일째 못 찾아,Social
조국 서울대와 진실 공방 사표 안 받아 월급 받았다  사의 없었다,Social
대법원 합리적 이유 없는 임금피크제 무효연령 차별,Social
빅뱅 승리 개 혐의 유죄 확정징역 년 개월,Social
단독 술자리서 부하 직원 성희롱경찰 진상조사 착수,Social
방역지원금 문자 조심하세요 경찰 사기주의 당부,Social
세무신고 맡겼더니실업급여 억만원 허위로 타낸 사무장,Social
질병청 백신 이상반응 심낭염 추가 인정,Social
 방역엔 과학적 접근만 정치방역 허용 안할 것,Social
전자발찌 살해 강윤성 국민참여재판서 계획범죄 아냐,Social
사이드미러 툭 스치자염좌뇌진탕이라며 일 입원한 차주 영상,Social
계곡살인 이은해 딸 입양무효 소송 수원서 진행된다,Social
유정복박남춘 고발전사전투표 하루 앞두고 막판 네거티브,Social
사전투표  민주당 대전 국회의원 허태정 뽑아달라 총출동,Social
데이바이데이 골드테크냐 아트테크냐,Social
실제 위성 싣고 쏜다 누리호 발사 준비 착착,Social
대 의붓딸 수차례 성폭행한 대 아빠 징역 년 선고,Social
 한국노총 건설노조위원장 아들 충청지부 지회장 세우며 노조 사유화,Social
년 사이 대전충남은 인구 줄고 세종은 늘어날 전망,Social
년 끌다 나온 업무방해죄 합헌 결정대법 판례 두고 의견 갈렸다,Social
장애인단체 숨진 장애가족 추모 행진한때 강남 도로 점거종합,Social
공룡 피자 만들어줘요 터무니없는 주문에피자집 사장이 한 일,Social
대통령 과학방역 강조심낭염도 백신 이상반응 인정,Social
 뉴스파이터이재명 인천 외지인 사는 곳국민의힘 이부망천 넘는 망언,Social
김용남 수원시장 후보권성동 원내대표가 군공항 이전신분당선 조기착공 보증인,Social
올해 준다던 농어민수당 감감무소식이네요,Social
한동훈 조국때 만든 형사사건 공개금지 규정 개정 지시,Social
임금피크제 무효 판결에경영계 고용불안 우려 노동계 환영,Social
개똥 먹이고 도망가면 가족 죽인다노예 방 업주 징역 년 구형,Social
심낭염도 화이자모더나 부작용으로 인정,Social
외교부 윤미향 한일 위안부 합의 협의해 윤 측 최종합의 몰랐다,Social
돈 왜 안 갚아 말에 동료 흉기 난동현직 경찰관 송치,Social
임금피크제 무효 판결에 희비 갈린 재계노동계,Social
깎인 임금만큼 업무량 줄여야인건비 줄이기용 제동,Social
선 도전 조희연 중도보수 교육감은 허구 내가 보수 끌어 안겠다,Social
공기 전파 가능한 원숭이 두창 공포 확산외교부 예의 주시,Social
더는 죽지 않게 해달라 장애인 단체 발달장애 가족 잇단 사망 추모,Social
조국 아들 인턴확인서 허위발급 최강욱 대법원 상고,Social
부산 사상구청장 후보 부동산 투기 의혹 공방,Social
방역지침 어기고 대규모 집회 민주노총 부위원장 구속기소,Social
국내 비축 원숭이두창 백신은 세대세대 확보해야,Social
모두 안녕 세 유튜버 꾸밍 세상 떠났다난소암 판정 년만,Social
격전지 사전투표  경기도지사기초단체장 판세 모두 안갯속,Social
오후 시 만명 확진전날 동시간보다 명종합,Social
서울대 사직의사 표명 없었다  조국 분명히 말했다 진실공방,Social
음주운전 반복 가중처벌 윤창호법 효력 상실,Social
후보 넷 군공항 이전진보당 폐쇄 무등산 케이블카는 국힘만 찬성,Social
사이드미러 닿았는데뇌진탕으로 한의원 입원했다는 피해차주 세상만,Social
교수직 사직의사 표명 했다더니 서울대 조국 그런적 없다 진실공방,Social
녹색 도심 건물에서 채소 재배밭보다 배 수익,Social
 사저 매입자는 홍성열  사저 사들인 콜렉터,Social
사고 현장 떠난 제네시스 또 나타났다음주 뺑소니범시민 눈썰미에 붙잡히다,Social
속보영상 엄마가 아이를 죽였습니다이 끔찍한 사건들 멈춰달라,Social
모더나화이자 부작용에 심낭염도 인정보상 소급적용,Social
 없어질 수도 발언한 머스크 이번엔  출산율 경고 가장 빠른 인구 붕괴,Social
거꾸로 가는 헌재윤창호법 위헌 결정에 운전자 부글부글,Social
총선 달궜던 칼럼 민주당만 빼고헌재 기소유예 유지,Social
한동훈 조국의 형사사건 공개금지 손보기로,Social
제동걸린 임피제 합리적 이유가 관건 임금체계 재편줄소송 예고,Social
위안부 억엔 합의 몰랐다던 윤미향 발표 전날 미리 들었다,Social
김혜경 고발한 의뢰인 신상공개 이정렬 변호사 벌금 만원,Social
아이 팔에 수상한 멍 자국가게 아저씨가 찾아낸 아동학대,Social
전자발찌 살인 강윤성 울먹이다가 안경 척 쓰고 셀프 변호,Social
분향소 설치 놓고 장애인단체지하철 측 충돌진통 끝 합의종합,Social
장애가정 되풀이된 비극 강요당한 죽음국가 없었다,Social
멸공 외친 정유라 천안함 년 된 줄공산당은 북한으로 가라,Social
새마을금고중앙회 직원 횡령 사고 특별검사사고액 전액 보상종합,Social
다리공사 현장서 톤 교량구조물이 트레일러 덮쳐운전자 심정지,Social
부산롯데타워 시 경관심의위원회 조건부 통과,Social
서울교육감 진보진영 단일화하는데 보수후보 이전투구 가열종합,Social
행안장관 직접 경찰 통제하나법무부검찰 모델 도입 촉각,Social
신림선 개통 호선 서울대입구역 도마 위에,Social
단독 직장내괴롭힘 신고했다가 무더기 실직 불똥,Social
단독 대통령실 경비 경비단서 실탄 발 분실못 찾았다,Social
너 죽고 나 죽자 돈 갚으라는 동료에 흉기 휘두른 경찰,Social
내일날씨대체로 맑은 전형적 월날씨서울 등 출근길 빗방울,Social
박정하 국민의힘 원주갑 국회의원 후보 박지현 총알받이로 쓰려하나 비판,Social
퇴임 김강립 식약처장 모두 힘 합쳐 코로나 위기 극복하길,Social
사직의사 표명 없었다는 서울대에 조국 분명히 말했다 반박,Social
기준금리  시대 눈앞,Social
김은혜 후보 경기 동부 자연보전권역에 대학병원 유치대규모 대학 캠퍼스타운 조성,Social
조국 아들 허위 인턴확인서 발급 최강욱 대법에 상고,Social
윤석열 북 미사일 다음날 술집 갔다 국힘 대변인은 사진 조작,Social
과거 인사 문제에 발목 잡힌 두 구리시장 후보,Social
나이만으로 임금 깎을 수 없다 기업 임피제 수술 예고 대법 임금피크제 제동,Social
대법 합리적 이유 없이 연령만으로 임금피크제 적용은 무효,Social
임금피크제 대법원이 제동유무효 첫 판결 줄소송 예고,Social
리포트 연령 차별 임금피크제는 무효처음 제시된 판단 기준,Social
헌재 예비군훈련 통지서 전달 안 한 가족 형사처벌은 위헌,Social
서울교육감 진보진영 단일화하는데 보수후보 이전투구 가열종합,Social
스태프 성폭행 강지환심 제작사에 억 배상,Social
 내일부터 이틀간 사전투표 외,Social
배 주면 손흥민 티켓 팔게요브라질전 암표 거래 극성,Social
헌재 년간 심리하고도 단순파업 업무방해죄 처벌 합헌,Social
음주측정 거부 가중처벌도 위헌 누더기된 윤창호법,Social
대통령이 쓰던 책상과 거실 모습은 상징 본관관저 내부 첫 개방,Social
전자발찌 살인 강윤성 우발적 범행계획한 것 아냐,Social
진안서 교량구조물이 트레일러 위로 추락운전자 사망,Social
 살던 집 매입한 사람은  등 대통령 사저 콜렉터,Social
성폭행 강지환 드라마 제작사에 억 배상 판결심도 패소,Social
대법원 나이 많다는 이유로만 월급 깎는 임금피크제는 불법뉴스룸 예고,Social
대법원 임금피크제는 연령 차별노동계 환영기업은 비상,Social
공무상 병 얻은 소방관 보상받기 쉬워진다,Social
서울대 학생 명 전장연 향한 혐오 메아리 부끄럽다,Social
부산교육감 후보  토론회 어땠나정책 대결은 실종 상대 흠집내기 공방,Social
슈퍼컴퓨터로 감염병 유행 예측  윤석열표 방역 시동,Social
물가 전망 로 올리고성장률은 로 낮춰,Social
도성훈 인천교육감 후보 최계운 배우자 재산누락 주장,Social
을숙도대교 음주사고 탑승자 명 구조한 시민들 부산경찰청장 표창,Social
주인 모르게 치킨집 위장 취업실업급여 타낸 브로커 구속 기소,Social
헌재 반복 음주운전측정거부 가중처벌도 위헌윤창호법 효력 상실,Social
신호위반 치여 뇌사세 대기업 신입 명 살리고 떠났다,Social
헌재 변호사 플랫폼 가입금지 변협 광고규정 일부 위헌종합보,Social
년 넘은 제도재계 임금피크제 위법 판결에 당혹,Social
병장 승리 징역 년개월 확정만기전역 꿈 물거품,Social
슈퍼컴퓨터 들여오는 질병청정부 데이터 중심 과학방역 가속도,Social
내일날씨 전국 대부분 맑고 강한 바람경기강원 가끔 비,Social
반신 마비 대  마구 때려 살해국가대표 출신 권투 선수에 항소심도 징역 년,Social
신호위반 차량에 뇌사 대 여성심장 기증하고 하늘로,Social
대법 연령 기준만 적용한 임금피크제는 무효 위법성 판단 기준 제시,Social
헌재 비정규직 해고에 특근 거부한 노조원 처벌은 합헌,Social
대 의붓딸 여러 차례 성폭행한 대 남성 징역 년,Social
성폭력 피해자의 국민청원과 권성동 의원의 법안 발의,Social
이장님 계세요 빈집 확인하고 농촌 주택 곳 턴 절도범 검거,Social
도와주세요 듣자마자 시민들 바로 달려가 제보영상,Social
아기가 공룡 피자가 먹고 싶대요 요청 승낙한 점주네티즌은 진상 비난,Social
임금피크제 제동대법원 연령 차별,Social
 다시 만나자 전 여친 차에 가두고 목 조른 대 집유,Social
조국 아들 허위 인턴 최강욱 심 의원직 상실형 불복해 상고,Social
 다음 달 결혼인데예비 신부 시간 감금  폭행한 예비 신랑,Social
신입 공무원에게 직장 갑질 대 공무직 정직 개월,Social
대전 민주국힘 사전투표 전날 고발전,Social
정부 방역지침 위반하고 만명 도심 집회민노총 부위원장 구속기소,Social
학력 기재 선거법 위반 하윤수 후보 단순 착오일 뿐,Social
다시 보기하연수가 자극적  기사에 울린 경종,Social
사전투표 앞둔 울진군수 후보들 장외설전,Social
신호위반 차량에 치인 대 새내기 명에 새 삶 주고 떠났다,Social
톤 교량구조물 지나가던 트레일러 덮쳐 대 고립심정지,Social
안온한 의사생활 버리고 번 미친 모험가 심영기 연세에스의원 원장,Social
에너지 신입사원 최현수 씨 명에 새 생명 불어넣고 영면,Social
노동계 환영  경영계 당혹깎인 임금 돌려줘 소송 잇따를 듯,Social
신호위반 차량에 뇌사대기업 갓 입사한 대 새 삶 주고 떠나,Social
올해 대기업 합격 대 딸이 신호위반 차량에 참변장기기증 결정,Social
임미리 민주당만 빼고헌재 대 격론 끝에 선거법 위반,Social
크랩 인생샷 남길 수 있는 전통 불꽃놀이 낙화놀이를 아시나요,Social
특근 거부 등 파업 업무방해죄 처벌은 합헌,Social
 집 이어 양산 집 억에 산 사저 컬렉터 누구,Social
 실시간뉴스 버닝썬 의혹 가수 승리 징역 년 개월,Social
헌재 서부지법 수사기밀 누설 혐의 현직 판사 기소유예 취소,Social
신호위반 차량에 치인 세 여성 명에 새삶 주고 떠나,Social
보 비다운 비 언제쯤긴 가뭄에 농작물 목탄다,Social
대규모 명퇴바람 부나대법 임피제 판결 후폭풍 예고,Social
만명 불법 집회 주도 민노총 간부 기소,Social
가수 승리 성매매도박 등 개 혐의 유죄만 달러 도박자금 추징은 취소,Social
부산 롯데타워 경관심의 통과백화점 영업 연장은 불투명,Social
노사 합의했어도정년 연장없이 인건비만 줄이면 안돼,Social
일하고 먹는 공간 보니대통령 생활 그려져요,Social
정년유지형 거의 없어고용부 파장 제한적,Social
경찰 마약에 취해 시민들 차로 들이받은 대 남성 체포,Social
조국 아들 인턴확인서 허위발급 최강욱 대법원 상고,Social
생면부지 시민에 커피 달라 했다 거절당하자 차량으로 쾅대 구속,Social
성매매 알선상습도박 빅뱅 전 멤버 승리 징역 년 개월 확정,Social
성추행 재판  힘찬 강제추혐 혐의로 또 피소,Social
두달째 인천공항서 먹고 자고참전국은 문 열어주지 않았다,Social
위안부 합의 외교부 문건 공개윤미향과 협의,Social
유명 남성잡지 모델 호텔서 무슨 일이심서 법정구속,Social
후배 부사관 유사 강간한 전직 해병대 부사관 집행유예,Social
중국산 잡곡이 국산으로 둔갑억 원어치 판매,Social
방역지침 어기고 도심 집회민주노총 부위원장 구속기소,Social
순천시장 선거 지지도 무소속 노관규  오하근 ,Social
정유라 고영태부터 쥴리프레임까지 레퍼토리 똑같아멸공 공산당은 으로,Social
안산천 잉어 떼죽음윤화섭 후보 유세 중단 현장 점검,Social
전자발찌 훼손살해 강윤성 국민참여재판서 계획 살인 아냐,Social
구중궁궐이 따로 없네 청와대 본관 규모에 놀란 관람객들,Social
전쟁터에서 떨고 있는 동포를 그냥 둘 수 있나요,Social
서울교육감 사전투표 진보 조희연 결집  보수 갈등 격화,Social
득점왕 등극 후 첫 평가전티켓 만 원 치솟은 암표값,Social
생애 첫 직장 근무 개월만에 성추행범죄자 소굴 울릉도 낙인,Social
유명 남성잡지 모델 마약 투약 혐의로 심 실형법정구속,Social
김승희 후보자 바이오 로펌  복지부 장관이해충돌 논란,Social
정책 뒷전 부산교육감 선거 방송토론회시간 넘게 도덕성자질 의혹 공방만,Social
헌법재판소 단순 파업 업무방해죄 처벌은 합헌 년 만에 판단,Social
전자발찌 살인 강윤성 눈물 사랑했던 사람 죽어서 자수했다,Social
코로나 백신 롱 코비드는 얼마나 막을까,Social
장애인단체 지하철 승강장에 분향소 설치보안관과 충돌,Social
지역 기여도 낮아도 돈만 벌면 장땡 롯데백화점 광복점 영업 중단 위기,Social
신호위반 차량에 치인 세 여성 명에게 새 생명 주고 하늘로,Social
계곡살인 이은해 딸 입양무효 소송 인천수원으로 이송,Social
논란 많던 복지부 장관에 김승희 전 의원 내정되자의약단체 반응 엇갈려,Social
한수원 정재훈 사장 퇴임직전 특별 승격 인사 비난,Social
계곡살인 이은해 딸 입양무효 소송 인천수원으로 이송,Social
심야에 행인들 차량으로 들이받은 대 구속마약 양성 반응,Social
명 실종 스텔라데이지호 부실 검사 선박검사원 무죄 확정,Social
전자발찌 끊고  명 살해한 강윤성 범행 계획한 것 아냐,Social
파업한 죄 묻는 건 합헌이라는 헌재 과반이 위헌 의견 낸 이유,Social
 치매 막말 논란 김승희 복지부 장관 후보자 이번에도 가시밭길,Social
돈 가져올게요 하고 사라진 손님택시비 만 원 먹튀,Social
강원랜드 채용비리 김재홍 차관 헌재 기소유예 취소,Social
약에 취해 행인에게 커피 달라거절당하자 자동차로 들이받은 대,Social
박근혜 이어  사저까지홍성열 회장 대통령 사저 컬렉터,Social
지하철 호선 연장 공약 놓고 여야 김포시장 후보 설전,Social
서울대 의약대 출신 여성 인방 정부 과학방역 전면 포진,Social
신규 공무원에 부적절 언행 지자체 대 공무직 중징계,Social
헌재 법원 내부 수사기밀 유출 혐의 현직 판사에 기소유예 처분 취소,Social
영상 이런 나라에 아이 낳은 내가 죄인 장애인 가족 위한 추모제,Social
새마을금고중앙회 직원 횡령 사고 특별검사사고액 전액 보상,Social
년 사이 딴 세상 된 서울한국인의 끈기와 인내 배워야,Social
보상 없는 임금피크제 무효 판결에 노사 협상 문 새로 열리나,Social
선거 앞두고 군위 위장전입 논란경찰 수사 나서,Social
헌재 민주당만 빼고 선거법 금지 행위임미리 민주당 쇄신 동기되길종합,Social
설왕설래군수 후보 전과 범 논란,Social
고용부 임금피크제는 위법 확대해석 경계정년연장 등 따져봐야,Social
세인데 키 가장 작은 청소년 기네스 오른 네팔 남성,Social
파이터로 전환한 이재명윤형선이 내세울 건 연고밖에 없어,Social
다음 생에 봐요세 시한부 일상 전해온 유튜버 세상 떠나,Social
신분당선 강남신사 구간 일 개통광교신사 분,Social
금요일 대체로 맑고 중부지방 약한 비강한 바람 주의,Social
신현준 갑질프로포폴 주장 전 매니저 월 항소심 첫 공판,Social
수입차 상습 절도 대들 경찰과  추격전검거 완료,Social
만원 안 갚았다고 지인 흉기로 살해한 대 중형,Social
헌재 민주당만 빼고 칼럼 선거법 위반 판단기소유예 정당종합보,Social
대법원 제동에 임금피크제 변화 오나업무 저감 여부 관건,Social
내 집에 들어가도 거주자 반대하면 주거침입 대  벌금형,Social
방서 업주손님 흉기 협박 대 현행범 체포,Social
해운대구서 나체로 교통정리하던 여성 가족에 인계무슨 사연,Social
조병국 파주시장 후보 지하철 호선 연장 재정사업으로,Social
박정하 국힘 원주갑 후보 박지현에 말 없는 이광재원창묵 비판,Social
소멸 실감 수도권 대학 갈 것 존폐 위기 맞은 지방대,Social
성추행 재판중  힘찬 강제추행 혐의로 또 입건,Social
대법 나이를 이유만으로 도입한 임금피크제는 무효,Social
내 땅에서 나가 이웃집 농작물 훼손 대 여성 항소심서 감형,Social
임금피크제 무조건 무효 아니다법조계 합리적 이유 판례 쌓여야,Social
조국 아들 허위 인턴 최강욱 심 판결 불복해 상고,Social
프레스룸 날씨 여름 더위 주춤밤사이 경기영서 비,Social
김승희 코로나 초기 전체 입국제한 주장 치매 발언도,Social
청와대 미남불상 년 만에 고향 경주로 돌아올까,Social
힘찬 강제추행 재판 중 또 같은 혐의 피소,Social
성매매할래 여장 유튜버에 속아 생방송 중 폭행한 대 경찰 입건,Social
대통령 과학방역 강조심낭염도 백신 이상반응 인정,Social
배달앱 악평은 괜찮고 왜 나만 갑질 목사 모녀 재판서 눈물,Social
김학의 불법출금 차규근 직위해제 취소 소청심사 청구,Social
조배숙 전북도지사 후보 김관영 논문 표절 사과해야김관영 송구하다,Social
가수 승리 징역 년개월 확정전역처리민간교도소 이감,Social
주인 몰래 여명 치킨집 위장취업실업급여 타낸 대 구속기소,Social
계곡살인 이은해 딸 입양무효 소송 수원가정법원으로 이송,Social
장애인권리예산 반영하라전장연 추경호 집 앞서 집회,Social
남성 잡지 모델 마약 투약 징역 개월법정 구속,Social
대 의붓딸 성폭행한 인면수심 대 징역 년 선고,Social
전국 돌며 문 안 잠긴 승용차 훔친 대 명 붙잡아,Social
대법 나이를 이유만으로 도입한 임금피크제는 무효,Social
아내랑 이혼해라 폭언에 수십차례 찔러 아버지 살해한 대,Social
헌재 예비군 소집통지서 전달 안한 가족 처벌하던 예비군법 위헌,Social
현대자동차 올해 임금협상 장기화 가능성,Social
년생 김지영 아버지 배우 이얼 암 투병 끝에 별세,Social
휴대전화 잃어버린 척 무료식사 요구서울경기 활보한 사기꾼 정체,Social
대낮 아파트 무단침입한 대 남성 로 추적 검거,Social
대기업 채용문 활짝대 그룹 년간 만명 이상 뽑는다종합,Social
여름휴가 갈 수 있을까 끊임없는 감염병 공포,Social
급격히 늙는 부산 년 중위연령 세,Social
박선영 서울교육감 후보 단일화 효과 미미보수 위는 바로 나,Social
헌재 윤창호법 조항 위헌 판단효력 상실,Social
계곡살인 이은해 친딸 파양소송인천수원가정법원 이송,Social
장애인 가족 추모 분향소 진통 끝에 설치시간 지원체계 구축,Social
밀린 임금 왜 안 줘 흉기로 선주 협박한 대 실형,Social
마약 취해 행인에 커피 좀 달라거절 당하자 차로 돌격,Social
헌재 반복 음주운전측정 거부 가중 처벌에 위헌 결정윤창호법 효력도 상실,Social
대통령 집 수집가  이어  사저까지 사들였다,Social
헌재 노조 파업 업무방해죄 처벌은 합헌년 만에 결론,Social
 교량 구조물이 트레일러 덮쳐 운전자 사망,Social
한동훈 조국이 만들었던 형사사건 공개 금지 개정 작업 지시,Social
이장님 계세요농촌 빈집 턴 대 절도범 검거,Social
송영길 성접대 의혹 제기 시민단체 대표 고소경찰 수사,Social
최악의 저출산 지속 시 년 후 서울 인구 만명으로  급감,Social
음주운전과 측정거부 회 이상 가중처벌도 위헌 윤창호법 효력상실종합,Social
개정된 윤창호법도 위헌 책임 비해 형벌 과해,Social
오늘의 운세 월 일 금요일 음력 월 일 ,Social
한동훈 검수완박 위헌  띄웠다검찰 에이스 총동원,Social
대법 합리적 이유 없는 임금피크제는 무효,Social
노동자 파업 업무방해 처벌 합헌헌재 년 만에 대 결론,Social
비극적 죽음 막아달라발달장애인 시간 돌봄 절실,Social
충북지사 후보 표심잡기 총력전일 여야 이준석윤호중 지원유세,Social
영상사이드미러 스쳤는데 뒷목 잡고 뇌진탕치료비 줘야하나,Social
 양산 매곡동 집 산 홍성열 마리오아울렛 회장 집도 매입,Social
변광용 거제시장 후보 대시민 호소문 공정투표로 심판,Social
나랏돈 억 슬쩍해 주식투자간 큰 공무원 징역 년,Social
대법 임금피크제 판단기준 첫 제시향후 노사관계 영향,Social
억 원 빼돌려 도박 등으로 탕진수자원공사 직원 징역 년,Social
공항 난민 명 방치한 법무부에재판부 심사도 안 하고 가혹,Social
박지현을 지키자서 박지현 수호 맞불 확산,Social
대법 합리적 이유 없는 임금피크제는 위법,Social
커피 안 준다고차로 행인 명 들이받은 대 마약 양성,Social
남양주시 동양하루살이 천적 토종어류 대농갱이 방류,Social
헌재 변호사 로톡 가입 금지 변협 규정은 위헌,Social
박근혜이명박문재인 사저 싹쓸이 매입한 홍성열은 누구,Social
김진표 국회의장 후보 양승조 후보가 충남지사 적임자,Social
대 중 대 새싹 따릉이 이용률은 월평균 대,Social
헌재 현직 부장판사 사법농단 기소유예 처분 취소 결정,Social
여름철 재유행 최대 만 명 예상차 접종 등 대비해야,Social
청와대 본관관저 개방 첫날시간 반 기다림도 즐거운  관람,Social
평산마을 확성기 소음 대신 시위자 고성 신경전,Social
왜 이혼 안해 내연남과 말다툼 중 흉기 살해대 심도 징역 년,Social
단독 갚을 돈 없다 너 죽고 나 죽자 동료에 칼 휘두른 경찰,Social
무인점포 범죄와의 전쟁순찰 현장 동행해보니,Social
헌재 단순 파업도 업무방해죄 처벌년 만에 합헌 결정,Social
전자발찌 살인 강윤성 우발적 범행계획한 것 아냐,Social
아빠 찬스 전대병원 직원 아들 임용취소 정당하다광주고법,Social
위안부 억엔 합의 발표 전날 윤미향에 알려외교부 문건 공개,Social
법원 아빠 찬스 전남대병원 직원 아들 임용취소 정당,Social
헌재 민주당만 빼고 칼럼 임미리 교수 기소유예 처분 일부 잘못,Social
헌재 서부지법 수사기밀 누설 혐의 현직 판사 기소유예 처분 취소,Social
노관규 규탄 기자회견 뒷 배경은 여성 정치인 앞세운 민주당 지역위사무실,Social
