titles,category
김대호 박사 오늘 기업사람 샤프텐센트에어비앤비애플현대차삼양식품,Economic
심텍 구조적 호황 지속년연속 주가상승은 부담,Economic
연우 전방산업 업황 부진 예상보다 길어져목표가,Economic
팔도비빔면 도 넘은  상술 논란무슨 일 있었길래,Economic
뉴스새벽배송 의사록에 증시경기부양 시사,Economic
와이지엔터 오매불망 기다리는 블랙핑크목표가현대차,Economic
한국공항 실적회복 관건은 정기편 증설 속도이베스트,Economic
한국투자 한국가스공사 유가금리 인상 오히려 긍정적,Economic
 연우 길어지는 전방 수요 부진목표가,Economic
디스플레이 샤프로부터 배상금 억 받는다특허 계약 위반,Economic
테고사이언스 대해부세포치료제 기술 글로벌 가장 앞서,Economic
전경련  최저임금 인상속도  평균의 배과속 자제해야,Economic
오늘 한은 금통위 개최기준금리 인상 전망,Economic
국산 신약 최초 글로벌 매출 조이노엔이 장담한 근거,Economic
홀딩스 분기 영업이익 감소 전망중국 내 철강재 수요 회복 관건,Economic
내가 막차 탔구나 영끌족 멘붕투매 임박 집코노미,Economic
정부 다시 뛰는 재계금호석화 로 사업기회 발굴미래변화 선제 대응,Economic
외환브리핑연준 두 번 더 빅스텝 재확인환율 원대 등락,Economic
에너지솔루션  점유율 끌어올린다목표가 만원 키움,Economic
채식주의 소비자 급증비건 사업에 속도 내는 식품업계,Economic
이 길이 아닌가봐 아직도 헤매는 동대문디자인플라자 김영찬의 디자텔러,Economic
오미크론 영향으로 월 사망자 역대 최다만 명 넘었다,Economic
해성디에스 반도체기판 판매가내년까지 고성장삼성,Economic
아모텍  저점과 하반기  흑전 모멘텀,Economic
엔비디아 기대에 못 미친 매출액 전망시간외서 대 급락,Economic
한국 노동생산성 대비 최저임금 너무 높아전경련 경고,Economic
달러 숨 고르기분기 하락 압력 이어질 수도,Economic
주택 거래 부진에 월 인구 이동 년 만에 최소,Economic
금리 인상 유력개미 투자자들에 미치는 영향은아침 라이프,Economic
이슈분석 이창용호 첫 금통위 금리 인상 촉각향후 행보는,Economic
기자수첩모니모가 내다버린 삼성스러움,Economic
클릭 종목엔솔  대 자동차 메이커에 배터리 공급바이든 정부 수혜,Economic
주거형 오피스텔 시흥시청역 루미니 월 분양 예정,Economic
반도체 전쟁 속 연간 인력 배출 대만 만 중국 만우리는한판승부,Economic
연준 최소 번 더 빅스텝 간다공격 긴축 예고종합,Economic
쫌아는기자들 인공지능이 농사했더니 생산량이 생산량이 배로,Economic
블록버스터 시대퓨쳐켐 확실한 치매 치료제 나오면 성장 폭발,Economic
에너지솔루션 년까지 타이트한 수급 기대키움,Economic
현대엔지니어링 힐스테이트 동탄 르센텀 월 분양,Economic
테고사이언스 대해부세계 최다 세포치료제 상용화 기업의 비결,Economic
전세금 보증 가입하면 돼 믿었는데나쁜 집주인 거를 방법 없다,Economic
폐가죽의 대변신혁신기술에 나이키 이어 도 찜,Economic
외국인 관광객 돌아온다정상화 채비하는 면세업계,Economic
루나 사태 법정 공방 코앞제도 미비한 가운데 쟁점은,Economic
빅데이터일 오전 주식시장 심리 단계 매우좋음,Economic
경윳값 사상 처음 리터당 원 돌파올해 들어 원,Economic
한국가스공사  가격이익개선 구조적목표가한국,Economic
유류세 할인 약발 끝비싼 기름값에 운행 안 한다,Economic
금감원 직원 억원대 횡령 우리은행 수시 검사 연장,Economic
안전빵인데 쏠쏠남들 코인 폭락할 때 난 여기서 돈 번다,Economic
한여름 꿀잠 침구전기차 타이어 만드는 특수섬유,Economic
상장사 곳 중 곳 꽁꽁 언 증시에 년 사이 주가 하락,Economic
가상화폐 시세 테라 테라 으로 점찍고 부활,Economic
비행기 추락사고 같은 증시 전혀 재밌지 않다,Economic
오늘의 환율전망 유로화 약세 영향에 강세 원 상승 출발 예상,Economic
아모텍  양산 부능선 넘었다하이,Economic
에너지솔루션 장기간 공급 부족할 북미서 적극적 증설키움,Economic
서울 시세 억대 아파트 억원대 매각 진행,Economic
코로나 충격 월 사망자 첫 만명대인구 감소 역대 최대,Economic
조간브리핑 국민연금 수익률 석 달째 빨간불손실 규모 조,Economic
한은 금통위 오늘 기준금리 결정인상 가능성 높아,Economic
서학개미 뭐샀나 떨어지면 더 산다고위험 상품에 집중한 서학개미,Economic
세계은행 총재 우크라 전쟁 글로벌 침체 촉발 가능성,Economic
시승기 순하게 즐기는 의 퍼포먼스  메르세데스    세단,Economic
재택플러스 삼겹살참치회도말랑말랑,Economic
재택플러스 침대 가게에 침대가 없다왜,Economic
뉴욕증시  의사록에 안도 상승테슬라 메타 ,Economic
증시전략  월  물가에 촉각인플레 우려 완화될까,Economic
 의사록에 안도 랠리다우  올라,Economic
미국 안보리 추가 대북제재안 표결중러 거부할 듯,Economic
누리호 차 발사 주 앞진짜 위성 싣는다,Economic
누리호 초소형위성 개발자 발사통신 성공 간절히 기원,Economic
삼성 스텔란티스 합작공장으로 중장기 성장성 확보,Economic
테슬라 주가 폭락에머스크 재산 조원 증발,Economic
학식도 원 폭등런치플레이션에 도시락 편식 늘었다,Economic
한덕수 퇴직 공무원 동원해 규제 혁신 별도 조직 만들 것,Economic
외면받는 바이오 부활의 답은 이것해외서 기술력 더 인정,Economic
머스크 트위터 인수 자금 부담 덜었다트위터 주가 급등,Economic
 대한항공 합병 국내  의견 청취취항계획 확인,Economic
삼성하이닉스 분기 낸드 플래시 점유율 과반 넘어,Economic
김대호 박사의 오늘의 키워드  의사록엔비디아 쇼크푸틴 후계자윤종원 충돌한전 폭탄돌리기,Economic
서프라이즈 없다  의사록에 안도한 뉴욕증시,Economic
한전 자체신용도 낮아졌다 적자빚 더 늘어날 듯,Economic
글로벌 마켓 냉온탕 오가는 뉴욕증시  의사록에 안도 랠리,Economic
남성이 여성보다 편의점 더 자주 간다이용금액도 약 배 차이,Economic
은행서 문자 올까봐 무서워요 직장인들 마통 금리에 화들짝,Economic
합병 앞둔 한세엠케이 주간 주가에 눈 못 떼는 까닭,Economic
지나인제약  폭락년새  종목 주가 하락,Economic
로봇 집안으로 들어온다가사노동 돕는 로봇 시대 성큼,Economic
대웅제약 자가면역질환 신약 정조준파이프라인 확대,Economic
뉴욕증시 자이언트 스텝 없다  의사록에 안도 대지수,Economic
밀가루 가격 추가 상승 관측자영업자 시름 깊어진다,Economic
하림의 프리미엄 즉석밥 제일제당오뚜기 왕좌 흔들까,Economic
년 귀속 종합소득세 신고가이드 종소세의  몫 신고납부 잊어선 안된다,Economic
윤리경영과 담쌓은 신풍제약거액 비자금 조성 허위 공시로 주주 우롱,Economic
 내용 공개  안도 랠리 반도체 영향 살펴야,Economic
  증시 충격 계속되자 속도조절론 부상,Economic
올 들어 내리막 탄 제약바이오주 하반기엔 반등할 수 있을까,Economic
최악 지났나  회의록 공개에 오른 증시 뉴욕마감,Economic
먹튀돈잔치찬밥신세 자초 이래서 바이오 못 믿어,Economic
서학개미 년 만에 감소증권사 어쩌나,Economic
 정부 초대 공정위원장에 장승화 내정이번주 발표 전망,Economic
안 오셔도 돼요가상세계서 만나요 메타버스로 예산 짠다,Economic
변동성 커지는 시장 포트폴리오 조정하는 방법 더 머니이스트하박사의 쉬운 펀드,Economic
화이자  원숭이두창 큰 걱정 안 해상황 지켜봐야,Economic
억 단위 뚝뚝그게 되겠어요 분당 집주인들 속탄다,Economic
패션 날았다거리두기 풀리자 실적 쑥,Economic
신선한 경제 아파트값 치솟자 빌라 전월세로 몰렸다,Economic
 신촌 최루탄 해장라면 훼드라 라면 단독 판매,Economic
경쟁률 찬바람 지방 청약시장그래도 믿을 건 브랜드뿐,Economic
글로벌 비즈 나이키도 러시아 떠난다 최대 가맹점과 계약 연장 안해탈러시아 동참,Economic
연준 두어번 더  금리인상해야,Economic
사장님대도 금융으로 부실 대책 마련했나,Economic
경쟁률 찬바람 지방 청약시장그래도 믿을 건 브랜드뿐,Economic
글로벌 비즈 나이키도 러시아 떠난다 최대 가맹점과 계약 연장 안해탈러시아 동참,Economic
연준 두어번 더  금리인상해야,Economic
사장님대도 금융으로 부실 대책 마련했나,Economic
인터뷰 활짝년 노하우로 장기 파트너 될 것,Economic
뉴욕증시  의사록에 안도 일제히 상승테슬라  출근전 꼭 글로벌브리핑,Economic
 대한항공 합병 국내  의견 청취취항계획자금력 확인,Economic
삼성전자 시스템 반도체 연구 인력 배 늘린다통합 칩 솔루션 도전 뒷북비즈,Economic
뉴욕 증시 대 상승 마감금통위 기준금리 올릴 듯 모닝브리핑,Economic
돼지 등심값도 껑충만 인분 국산 둔갑,Economic
삼성물산 단독 입찰로 시공사 못찾은 흑석구역 현산주민대표회의 접촉,Economic
지선 속 쏟아지는 규제지역 해제 요구내달 주정심에 관심집중,Economic
서촌 거리 가득 채운 관광객청와대 앞 상권 살아날까개방 나비효과,Economic
때가 왔다 가계대출로 재미 본 보험사들 금리 계속 올린다,Economic
연기금 엔솔 순매수 조원 돌파수급 쏠림 지속,Economic
권도형의 테라  결국 나온다일 가동 전망,Economic
통신주 상승세 여름엔 끝물장비주 시간 온다,Economic
삼성 테일러 공장 곧 착공조 실탄 텍사스에 또 투자하나,Economic
천연고무값 치솟으니바람 빠지는 타이어주,Economic
살인 이자에 우는 서민 제금융은 이자장사,Economic
년새 상장사 개 중 개 주가 추락성장주 추풍낙엽,Economic
월 국제선 항공 여객 만명 넘을 전망아직 코로나 전  수준,Economic
연준 빅스텝 두어번 더 필요한은도 오늘 기준금리 올릴듯,Economic
정부 자영업자 손실보상에 조 짜리 마이너스 통장 쓴다,Economic
재무통부터 전략실장까지 내린다 현대 지누스 지배력 강화,Economic
집나갔던 셀트리온 형제 돌아오나하반기 본업에서 실적 낸다,Economic
분양가상한제 개편안에 조합 이주비사업비 포함 유력,Economic
둔촌주공 시공단 빠르면 월 공사 재개 가능성 있다,Economic
월에 벌써 도철없는 무더위 전력예비율 대로 뚝,Economic
기준금리 로 올리고 물가 전망은 대로,Economic
만원선에서 줄타기 전자볕 들 날은 언제,Economic
년 전부터 씀씀이도 줄인 한전적자 더 커진 이유는,Economic
월 전세대란 잠잠해진 집값 과열 뇌관 되나,Economic
레벨 자율주행차 연내 상용화맞춤 보험 나올까,Economic
 득점왕 손흥민 내친김에 광고도 주름잡을까,Economic
편의점 누가 자주 이용하나남성이 여성보다 월 회 더 많아,Economic
고유가에  몰기도 부담 월 휘발유경유 소비량 뚝,Economic
두 달 연속 오르던 집값 전망 대출금리 우려에 하락 전환,Economic
위스키에 빠져든 비싸도 마시는 이유 힙하잖아요,Economic
년 타도 더 비싼 쏘렌토 웃돈 붙는 캐스퍼,Economic
백윤미의 손품임장 실거래 억 호가는 억 여의도 분컷 아파트 지금 사도 될까,Economic
하반기 경제전망 물가 상승 추세 년 안 간다 물가 못잡으면 성장 어렵다 ,Economic
하반기 경제전망   빅스텝 번 밟는다한은 기준금리 까지 올려야,Economic
장특공 손본다는 민주당 방침에 시장선 지금 하면 전세난 가중 우려,Economic
핑크퐁 이어 미니특공대도 상장 준비 판 커지는 키즈 콘텐츠,Economic
위기의 그룹 정몽규의 아시아나항공 인수전으로 작용,Economic
의료자문 통한 보험금 지급 거부 증가금융당국 경고,Economic
생보사 사망보험 역마진의 늪금리 인상 공포,Economic
재건축 규제 완화 기조에계산기 두드리는 재건축 조합집슐랭,Economic
돼지 공급 역대 최대라는데금겹살 된 이유는,Economic
대한항공 일축에도 계속되는 아시아나 합병 무산설왜,Economic
매파로 변한 이창용 오늘 첫 금통위빅스텝 발언에 촉각,Economic
재건 도와달라는 우크라나경원 특사 긴밀히 협의해 나가자,Economic
자이언트 스텝 없다 뉴욕증시 상승,Economic
미 연준 가파른 긴축 공감대중립금리 이상으로 올려야,Economic
맛있으면 비싸도 찾는다아웃백 대박 이끈 진대제의 승부수,Economic
유통가에 쏟아지는 은행 러브콜짝이 다 있다,Economic
못올렸던 전셋값 한번에 올린다역대급 전세대출 예고된 월,Economic
뉴욕증시  의사록에 안도 랠리다우  마감,Economic
경제 이미 스태그플레이션 진입노동경직성에 악화할 수도,Economic
 유일   어떤 경쟁 모델 나와도 걱정 없어,Economic
코인 테라 테라 으로 일쯤 부활할듯,Economic
임대차법 개편 전월세 대란 논란 잠재울까,Economic
 안 볼땐 액자로 쓴다요즘 뜨는 가전제품 의 비밀,Economic
영끌 공무원 오른 이자에 놀랐다연금대출  넘는다고,Economic
끝이 안 보여 한국타이어  최대 타이어 테스트 트랙 가보니,Economic
안 가져가면 어떡하나  조선 러시아 선박재고 비상,Economic
한미 원전동맹에 두산 조 투자로 힘 보탠다,Economic
무주택자 집살까 청년신혼부부 내년부터 년 만기 주담대 받는다,Economic
연준 두어번 더  금리인상해야긴축적 정책 필요종합,Economic
정권 바뀌면 기관장 교체 국책은행 인사태풍 몰아친다,Economic
만전자보다 매력적 외국인 소리없이 줍줍한  소부장 주식,Economic
잘 달리는 버스에서 아이구야 이런 사기꾼에 보험금 억 샜다,Economic
급매도 안 나가요 뚝 끊긴 아파트 거래월엔 요동칠 수도,Economic
다주택자 양도세 절세 한시적 중과 배제 활용하세요 이승준 세무사의 생활 속 재테크,Economic
실손 지급거절 갈등 커져도 땜질 처방만 하는 금융당국,Economic
둔촌주공 사태 실태점검대출만기분상제 변수,Economic
연내 청년신혼 년 만기 주담대 나온다,Economic
카페야 회사야 바다 보며 워케이션중입니다,Economic
뛰는 식용유값 우는 치킨집,Economic
환율 원대로 떨어졌는데외인은 들어올까 말까 고민만,Economic
수도권 외곽부터새 정부 기대감 썰렁했던 경매시장도 훈풍,Economic
오늘 이창용 첫 금통위인플레 압박에 기준금리 올릴 듯,Economic
단독무늬만 자영업자 꼼짝마주택구입용 꼼수대출 막는다,Economic
 상한제에 신재생민간발전 분노법적 대응 불사,Economic
여름휴가 안가고 만다항공권 배 베케플레이션 비명,Economic
무역수지 적자 벌써 억불연간 최대치 기록하나,Economic
한은 빅스텝 위축되는 투자심리,Economic
강남 출퇴근쇼핑몰 누리는 임대 아파트 년 간 이사걱정 ,Economic
대형플랫폼 제 루나테라 발행 땐한은 금융위기 불러올수도,Economic
만 원으로 인 삼겹살 파티 도전어림도 없네,Economic
전세대출 똑똑한 세입자 이렇게 받는다,Economic
인플레 번 언급한  추가 빅스텝 예고긴축 적절,Economic
어디 전세대출 이자 싼 곳 없나요오늘도 서민들은 웁니다,Economic
코스피코스닥 편입이 악재 공매도 표적될까 덜덜,Economic
오늘 기준금리  인상할 듯 이창용 총재의 첫 의사봉은,Economic
과도한 몸값 전략적 침묵 롯데카드 매각전 눈치게임 치열,Economic
닭고기 가격 담합 논란 가열,Economic
분기 서울지역 빌라 전월세 거래 역대 최다,Economic
엑시노스 버리고 새출발 팹리스  삼성  미래는,Economic
오늘 한은 기준금리 인상 유력빅스텝은 아닐 듯,Economic
삼성전자 하반기 수요가 관건인데경기 침체 먹구름,Economic
단독 한국만 규제 어렵다 특금법 시행령 검토 헛구호되나,Economic
차의 테루아르와 과학 미묘하고 복잡한 다향의 세계센서가 감별하는 시대 올까,Economic
  애플 잡겠다 샤오미의 자신감그 힘은 커뮤니티와 팬덤이다,Economic
 심리학 리더가 솔선수범할 때 직원들이 따라가는 건 심리적 목표 전염 효과,Economic
연준 중립에서 긴축으로 무게 중심 이동의사록,Economic
연준 번 더  인상중립금리 넘게 빨리 올려야상보,Economic
현대차가 전기 거점 선택한 조지아 이유는,Economic
글로벌 비즈 브리핑 루나 부활에  찬성테라 일 출시 전망,Economic
만전자 발동동 과거에도 그랬다폭락장 회복 얼마나 걸렸나부꾸미,Economic
편의점 강 중시대 이건 내가 최고지,Economic
집콕 끝 여행 시작 카드보험 혜택 미리 챙겨두자,Economic
업무용 승용차 운행기록부 꼼꼼히 써야 세금 혜택받는다,Economic
증시 하락세에도 리츠는  수익 높은 배당수익률도 매력,Economic
년안에 갚으세요 청년신혼부부용 주담대 나온다,Economic
뉴욕 왕복 만원 방역탓 운항 못늘려 가격 껑충,Economic
정의선 현대차 회장 대우와 사돈 맺는다,Economic
화장품 주가 하락은 마스크 탓이 아니었구나,Economic
전후 재건비용 러시아가 대야 우크라 외교장관,Economic
유류세 인하 약발 끝비싼 기름값에 운행 못 해,Economic
네덜란드 과학자들 중 양자 원격이동 성공양자인터넷 시대 여나,Economic
삼성스텔란티스 인디애나에 배터리 합작법인 설립,Economic
이앤씨 편한세상 시티 고색 월 공급,Economic
삼성 에 첫 배터리 생산공장 짓는다,Economic
  삼성 프리미엄  주도권 경쟁,Economic
새차보다 비싸 중고차가 기가 막혀,Economic
아니 주가가 왜 이래 리오프닝주 줄줄이 내리막길,Economic
이번엔 스냅 쇼크기술주 공포에 떤다,Economic
민간 발전사 이윤 빼 한전 적자 메운다니법적 대응할 것,Economic
소형모듈원자로가스터빈두산 차세대 에너지에 조원 투자,Economic
아파트 엄두 안 나 서울 빌라 전월세 거래 역대 최고,Economic
년 기다리느니 중고차 산다 신차 값에 팔리는 중고차,Economic
오늘일 금통위 열린다이창용 총재 첫 선택은,Economic
상폐 임박 맘스터치 공시 회피 꼼수 가맹점주 권익 침해 우려,Economic
뉴욕증시  의사록 대기하며 강보합세로 출발,Economic
 파도 속 정유반도체 기업 표정 관리,Economic
닻 올린 중국발 원자재 쇼크는 우려 요인,Economic
북미에 배터리 모종 이식수확만 남아,Economic
대출 한도 목마른 사람들년 장기대출 인기몰이,Economic
루나테라 폭락 미스터리,Economic
루나테라 코인의 몰락죽음의 소용돌이 덮친 가상화폐 시장,Economic
직장인이 코딩 배워보니 험난한 주경야독의 길끈기는 필수,Economic
용산서  대통령 만난 인들 소탈하고 친근이런 대통령 처음,Economic
줄어드는 전세 매물실거주 의무 완화금리가 시세 갈림길,Economic
비혼인가구 생계비가 최저임금 결정기준대표성 논란,Economic
청년주택 구입부터 규제완화년 만기 대출상품 나온다,Economic
코로나 충격 월 사망자 만 첫 돌파인구 만 사라져 역대 최대,Economic
저평가 기술주 많다그래도 하락 단계 남았다오미주,Economic
지역 실정 안 맞는 새 정부 부동산 대책,Economic
캐시미어를 두른 늑대우리가 욕망하는 모든 것 그의 손에 지배된다,Economic
최고 전기차 만들겠다는 유퀴즈 인터뷰 믿었는데 숨지말고 대화하자,Economic
픽뉴스 청와대 본관 공개  봉 샀는데 없다  에베레스트를 날다,Economic
유류세 인하 약발 실종운행 안 해,Economic
루나 사태 법적 책임 따지기에 구멍 커대책은,Economic
권도형 믿었다가 더 큰 손실 거래소도 책임,Economic
루나 사태로 불신 커진 가상화폐 관리감독 허점,Economic
감자튀김 빠진 햄버거 세트메뉴금자된 감자,Economic
국내선 답 없다토종  해외진출 속사정,Economic
리터당 천원 육박 경윳값 고공행진화물 총파업 예고,Economic
최대  할인지하철버스 정기권 나온다,Economic
착한 소비에 꽂혔다는 김대리 비건 샴푸는 뭘로 쓴대,Economic
떨어지면 더 산다간 큰 서학개미코인러들,Economic
집중취재 전세계 휩쓴 한국 웹툰  웹툰에 빠진 만화 강국 일본의 젊은 세대,Economic
우주 강국을 향한 꿈  누리호 차 발사 주 앞으로,Economic
기억나지 않는다옵티머스 재판 하나은행 증인 출석,Economic
한은 기준금리 추가인상 유력 한미 금리역전 시간문제 인상 불가피,Economic
해외변수에 왝더독테마주만 들썩 증시프리즘,Economic
정권 교체기 방치된 금융대규모 수장 공백에 중기 지원 약화 우려,Economic
일산 부동산에 볕드나리모델링 재건축 추진에 들썩 르포,Economic
바이오 빅 무브신약 주권 쟁탈전,Economic
팬데믹 특수 종료희비 엇갈린 스냅  줌비디오  ,Economic
빅맥스벅커피에어조던 다 못 산다나이키도 러시아서 철수,Economic
추락하는 생건해외사업 돌파구는,Economic
영토 넓히는 배터리 동맹북미 공장만 개 짓는다,Economic
증권형토큰 법제화 물살세대 잡는다,Economic
전문경영인만 문책한 정몽규  회장의 무책임한 인사,Economic
최대 실적에도 휘청에쓰오일 울산공장 화재 후폭풍,Economic
 눈 앞에 드리운 스태그플레이션이라는 그림자,Economic
 대한민국 새 출발 갈등봉합통합 넘어 메타버스 미래로,Economic
강남도 넘보는 용산하루 건너 개발 계획 나온다 부동산,Economic
월 사망자 이례적 급증인구 개월째 자연감소,Economic
정의선 회장 장녀 월 화촉 대우와 사돈,Economic
일러스트 이코노미내 대출 원리금 얼마나 오를까,Economic
한덕수 전기료 통제 안해윤종원 훌륭한 경험 가진 분,Economic
성공예감 재고 없는 아마존도 재고 있는 월마트도폭락한 이유는  더밀크 송이라 기자,Economic
오백슬라 위기서학개미는 테슬라 조 줍줍 서학개미 리포트,Economic
인도 설탕 곳간도 잠근다세계로 번지는 식량 보호주의,Economic
단독 금융위 코인 신속대응 요구에 한국만 규제 어렵다,Economic
윤석열표 청년주택 통합브랜드 나온다신혼희망타운 역사 속으로,Economic
누리호 두 번째 도전이번엔 실제 위성 탑재,Economic
내집 마련의 꿈 이룰까내년  전용 년 만기 모기지 나온다,Economic
변호사세무사약사 예전같지 않아요흔들리는 전문직,Economic
증시 추락에 연준 과속하지 말라 우려 쏟아져,Economic
 또 터진 횡령이번엔 돌려막기 외,Economic
삼성전자가 바꿨다기혼자 중심 복지체계 개편,Economic
코스닥 시총 위 누구엘앤에프셀트리온헬스케어 자리다툼종합보,Economic
새마을금고도 터졌다억 횡령 직원 자수 걸릴까봐,Economic
삼성  배터리공장 조 투자 스텔란티스와 합작법인 설립계약,Economic
숫자로 본 경제 서울 세종 집사교육 관건,Economic
임대차법 년 월세빌라로 밀려나는 서민들,Economic
원숭이두창 우려 차단 나선 세계모더나 백신 개발 시작,Economic
탈원전에  기술 개발 뒤처졌는데예산마저 삭감 위기,Economic
단독 소상공인 위탁보증 부실률 배 폭증조 더 묻고 더블로,Economic
 노후는 처음이라이번 생은 망했다 노후 파산 시그널은,Economic
고금리 계약상품 줄줄이 역마진 보험사 웃돈 주고 재매입하나,Economic
삼성전자 시스템 반도체  인력 배 늘린다,Economic
국세청 헬로비전 세무조사그룹 편입뒤 처음,Economic
늑장대응 질타에 코빗 루나 상폐코인원도 상폐 가닥,Economic
힘 못쓴 실적시즌  배 이하 저평가 종목 담아볼까,Economic
국제선 좌석수 유럽  늘었는데 한국은 뿐,Economic
자회사와 시너지 확대 삼바셀트리온 반등 기회 오나,Economic
전세 난민에송파 강서 광진 빌라까지 동났다,Economic
서민 기름 경유의 배신몰면 손해 안 몰면 굶는다,Economic
시장 왜곡  투기 차단 조합원 지위 양도제한 조기화 논란,Economic
오세훈의 신통기획 재개발 첫 사례 나왔다,Economic
대규모 대미 투자 눈치 보였나역대급 국내 투자 발표한 재계,Economic
씨레라 어닝쇼크신저가 골머리 강호성   대표격려금 노이로제 안동일 현대제철 대표,Economic
산업 막전막후 루나에 놀란 위메이드주가 폭락에도 코인 올인,Economic
